type,title,director,cast,country,date_added,release_year,rating,duration,genre
Movie,Bbuddah Hoga Terra Baap,Puri Jagannadh,"Amitabh Bachchan, Hema Malini, Raveena Tandon, Sonu Sood, Sonal Chauhan, Charmy Kaur, Prakash Raj, Makrand Deshpande, Subbaraju, Shawar Ali, Rajeev Verma",India,5-Jul-20,2011,TV-14,116 min,"Action & Adventure, Comedies, Dramas"
Movie,Blood Money,Vishal Mahadkar,"Manish Chaudhary, Kunal Kemmu, Amrita Puri, Shekar Shukla, Teeshay, Mia Evonne Uyeda",India,5-Jul-20,2012,TV-14,110 min,"Dramas, International Movies, Romantic Movies"
Movie,Boss,Anthony D'Souza,"Akshay Kumar, Ronit Roy, Shiv Pandit, Mithun Chakraborty, Johny Lever, Aditi Rao Hydari, Danny Denzongpa, Govind Namdeo, Parikshat Sahni, Aakash Dabhade",India,5-Jul-20,2013,TV-14,139 min,"Action & Adventure, Comedies, Dramas"
Movie,Chashme Baddoor,David Dhawan,"Rishi Kapoor, Ali Zafar, Taapsee Pannu, Siddharth, Divyendu Sharma, Anupam Kher, Bharati Achrekar, Lillete Dubey, Ayaz Khan",India,5-Jul-20,2013,TV-14,121 min,"Comedies, International Movies, Music & Musicals"
Movie,Dharam Sankat Mein,Fuwad Khan,"Paresh Rawal, Annu Kapoor, Alka Badola Kaushal, Auritra Ghosh, Naseeruddin Shah, Manoj Raghubir Sharma, Rushita Pandya, Murli Sharma",India,5-Jul-20,2015,TV-PG,127 min,"Comedies, Dramas, International Movies"
Movie,Drishyam,Nishikant Kamat,"Ajay Devgn, Shriya Saran, Tabu, Rajat Kapoor, Ishita Dutta, Mrunal Jadhav, Prasanna Ketkar, Yogesh Sonam, Prathamesh Parab, Rishabh Chaddha",India,5-Jul-20,2015,TV-14,162 min,"Dramas, International Movies, Thrillers"
Movie,Gabbar Is Back,Krish,"Akshay Kumar, Shruti Haasan, Sunil Grover, Kareena Kapoor, Ishita Vyas, Suman Talwar, Jaideep Ahlawat, Shruti Bapna",India,5-Jul-20,2015,TV-14,128 min,"Action & Adventure, Dramas, International Movies"
Movie,Gollu Aur Pappu,Kabir Sadanand,"Vir Das, Sandeepa Dhar, Dimple Kapadia, Kunaal Roy Kapur, Deepak Tijori",India,5-Jul-20,2014,TV-14,112 min,"Action & Adventure, Comedies, International Movies"
Movie,Madras Café,Shoojit Sircar,"John Abraham, Nargis Fakhri, Rashi Khanna, Avijit Dutt, Prakash Belawadi, Ajay Ratnam, Siddartha Basu, Agnello Dias, Dibang",India,5-Jul-20,2013,TV-14,128 min,"Dramas, International Movies, Thrillers"
Movie,Mary Kom,Omung Kumar,"Priyanka Chopra, Darshan Kumar, Sunil Thapa, Kenny Basumatary, Shishir Sharma, Robin Das, Rajni Basumatary, Lin Laishram, Shakti Singh",India,5-Jul-20,2014,TV-PG,120 min,"Dramas, International Movies, Sports Movies"
Movie,Oh My God,Umesh Shukla,"Akshay Kumar, Paresh Rawal, Mithun Chakraborty, Om Puri, Apoorva Arora, Arun Bali, Honey Chaaya, Poonam Jhawer, Mahesh Manjrekar, Govind Namdeo",India,5-Jul-20,2012,TV-PG,129 min,"Comedies, Dramas, International Movies"
Movie,One by Two,Devika Bhagat,"Abhay Deol, Preeti Desai, Lillete Dubey, Rati Agnihotri, Jayant Kripalani, Darshan Jariwala, Anish Trivedi, Geetika Tyagi, Preetika Chawla, Tahir Raj Bhasin",India,5-Jul-20,2014,TV-14,135 min,"Comedies, Dramas, International Movies"
Movie,Penalty,Shubham Singh,"Lukram Smil, Manjot Singh, Shashank Arora, Kay Kay Menon, Aakash Dabhade, Srishti Jain, Bijou Thaangjam, Mohit Nain, Ashwin Kaushal",India,5-Jul-20,2019,TV-14,125 min,"Dramas, Independent Movies, International Movies"
Movie,Players,"Abbas Alibhai Burmawalla, Mastan Alibhai Burmawalla","Vinod Khanna, Abhishek Bachchan, Bobby Deol, Sonam Kapoor, Bipasha Basu, Neil Nitin Mukesh, Sikander Kher, Omi Vaidya, Johny Lever, Shweta Bhardwaj",India,5-Jul-20,2012,TV-14,162 min,"Action & Adventure, International Movies"
Movie,Special 26,Neeraj Pandey,"Akshay Kumar, Manoj Bajpayee, Anupam Kher, Jimmy Shergill, Kajal Aggarwal, Divya Dutta, Kharaj Mukherjee, Rajesh Sharma, Kishore Kadam, Neeru Bajwa, Deep Raj Rana, Neetu Singh",India,5-Jul-20,2013,TV-PG,137 min,"Dramas, International Movies, Thrillers"
Movie,Tanu Weds Manu,Aanand Rai,"Madhavan, Kangana Ranaut, Jimmy Shergill, Deepak Dobriyal, Swara Bhaskar, Eijaz Khan, K.K. Raina, Rajendra Gupta, Ravi Kishan, Navni Parihar",India,5-Jul-20,2011,TV-14,114 min,"Comedies, Dramas, International Movies"
Movie,What the Fish,Gurmmeet Singh,"Dimple Kapadia, Vishal Sharma, Sumit Suri, Anand Tiwari, Deepti Pujari, Manu Rishi Chadha, Geetika Tyagi, Manjot Singh, Sabina Sheema",India,5-Jul-20,2013,TV-14,96 min,"Comedies, International Movies"
Movie,I Am Not Your Negro,Raoul Peck,"Samuel L. Jackson, Joey Starr","Switzerland, France, Belgium, United States",3-Jul-20,2017,PG-13,94 min,Documentaries
Movie,#AnneFrank - Parallel Stories,"Sabina Fedeli, Anna Migotto","Helen Mirren, Gengher Gatti",Italy,1-Jul-20,2019,TV-14,95 min,"Documentaries, International Movies"
TV Show,Abby Hatcher,Kyran Kelly,"Macy Drouin, Wyatt White, Paul Sun-Hyung Lee, Michela Luci, Christian Dal Dosso, Laaibah Alvi, Leo Orgil","United States, Canada",1-Jul-20,2019,TV-Y,1 Season,Kids' TV
Movie,Stardust,Matthew Vaughn,"Claire Danes, Michelle Pfeiffer, Robert De Niro, Charlie Cox, Sienna Miller, Ricky Gervais, Jason Flemyng, Rupert Everett, Peter O'Toole, Mark Strong, Kate Magowan, Ian McKellen","United Kingdom, United States",1-Jul-20,2007,PG-13,128 min,"Action & Adventure, International Movies, Romantic Movies"
Movie,The Mirror Boy,Obi Emelonye,"Edward Kagutuzi, Genevieve Nnaji, Osita Iheme, Fatima Jabbe, Victor Carvalho, Felix Ceesay, John Charles Njie, Momodu Musa Ceesay","United Kingdom, Nigeria",30-Jun-20,2011,TV-14,86 min,"Action & Adventure, Dramas, International Movies"
Movie,#FriendButMarried 2,Rako Prijanto,"Adipati Dolken, Mawar de Jongh, Sari Nila, Vonny Cornellya, Clay Gribble, Ivan Leonardy, Sarah Sechan, Jourdy Pranata",Indonesia,28-Jun-20,2020,TV-G,104 min,"Dramas, International Movies, Romantic Movies"
Movie,Ride Like a Girl,Rachel Griffiths,"Teresa Palmer, Sam Neill, Sullivan Stapleton, Stevie Payne, Brooke Satchwell, Magda Szubanski, Aaron Glenane, Damien Garvey, Sophia Crawford, Henry Nixon",Australia,27-Jun-20,2020,PG,99 min,"Children & Family Movies, Dramas, Independent Movies"
Movie,Eurovision Song Contest: The Story of Fire Saga,David Dobkin,"Will Ferrell, Rachel McAdams, Dan Stevens, Melissanthi Mahut, Mikael Persbrandt, Ólafur Darri Ólafsson, Graham Norton, Demi Lovato, Pierce Brosnan",United States,26-Jun-20,2020,PG-13,124 min,"Comedies, Music & Musicals, Romantic Movies"
Movie,Kasanova,Oluseyi Asurf,"Wale Ojo, Ireti Doyle, Alvin Abayomi, Toyin Abraham, Ruby Akubueze, Chimezie Imo, Tomiwa Tegbe",Nigeria,26-Jun-20,2019,TV-14,117 min,"Comedies, International Movies, Romantic Movies"
Movie,Thackeray (Hindi),Abhijit Panse,"Nawazuddin Siddiqui, Amrita Rao, Rajeev Panday, Sanjay Narvekar, Rajesh Khera, Prakash Belawadi, Avantika Akerkar",India,26-Jun-20,2019,TV-14,135 min,"Dramas, International Movies"
Movie,Prem Ratan Dhan Payo,Sooraj R. Barjatya,"Salman Khan, Sonam Kapoor, Anupam Kher, Neil Nitin Mukesh, Sanjay Mishra, Swara Bhaskar, Deepak Dobriyal, Arman Kohli, Manoj Joshi, Samaira Rao, Karuna Pandey, Sucheta Khanna",India,25-Jun-20,2015,TV-14,164 min,"Action & Adventure, Dramas, International Movies"
Movie,Vivah,Sooraj R. Barjatya,"Shahid Kapoor, Amrita Rao, Anupam Kher, Alok Nath, Seema Biswas, Samir Soni, Lata Sabharwal, Manoj Joshi, Dinesh Lamba, Amrita Prakash",India,25-Jun-20,2006,TV-14,166 min,"Dramas, International Movies, Romantic Movies"
Movie,Kappela,Musthafa,"Anna Ben, Roshan Mathew, Sreenath Bhasi, Sudhi Koppa, Tanvi Ram, Musthafa, James Eliya, Vijilesh",India,22-Jun-20,2020,TV-14,112 min,"Dramas, Independent Movies, International Movies"
Movie,The Royal Hibiscus Hotel,Ishaya Bako,"Zainab Balogun, Kenneth Okolie, Deyemi Okanlawon, Joke Silva, Olu Jacobs, Jide Kosoko, Rachel Oniga, Kemi Lala Akindoju, Ini Dima-Okojie, Toni Tones",Nigeria,22-Jun-20,2017,TV-PG,90 min,"Comedies, International Movies, Romantic Movies"
Movie,Destiny,Youssef Chahine,"Nour El-Sherif, Laila Elwi, Mahmoud Hemeida, Safia el-Emari, Mohamed Mounir, Khaled El Nabawy, Seif Abdelrahman, Abdalla Mahmoud, Ahmed Fouad Selim, Magdi Idris","France, Egypt",19-Jun-20,1997,TV-14,136 min,"Dramas, International Movies"
Movie,Feel the Beat,Elissa Down,"Sofia Carson, Wolfgang Novogratz, Donna Lynne Champlin, Eva Hauge, Rex Lee, Brandon Kyle Goodman, Lidya Jewett, Sadie Lapidus, Johanna Colón, Shaylee Mansfield, Shiloh Nelson, Justin Allan, Carina Battrick, Kai Zen, Marissa Jaret Winokur, Enrico Colantoni, Dennis Andres",United States,19-Jun-20,2020,TV-G,110 min,"Children & Family Movies, Comedies, Dramas"
Movie,The Emigrant,Youssef Chahine,"Khaled El Nabawy, Hanan Turk, Yousra, Mahmoud Hemeida, Safia el-Emari, Michel Piccoli, Ahmed Bedir","Egypt, France",19-Jun-20,1994,TV-14,130 min,"Dramas, International Movies"
Movie,A Whisker Away,"Junichi Sato, Tomotaka Shibayama","Mirai Shida, Natsuki Hanae, Hiroaki Ogi, Koichi Yamadera, Minako Kotobuki, Susumu Chiba, Ayako Kawasumi, Sayaka Ohara, Daisuke Namikawa",Japan,18-Jun-20,2020,TV-PG,104 min,"Anime Features, Children & Family Movies, International Movies"
Movie,Cairo Station,Youssef Chahine,"Farid Shawqy, Hind Rostom, Youssef Chahine, Hassan el Baroudi, Abdel Aziz Khalil, Naima Wasfy, Said Khalil, Abdel Ghani Nagdi",Egypt,18-Jun-20,1958,TV-14,73 min,"Classic Movies, Dramas, International Movies"
Movie,Dark Waters,Youssef Chahine,"Faten Hamama, Omar Sharif, Ahmed Ramzy, Hussein Riad, Ferdoos Mohammed, Aziza Helmy, Tawfik El Deken",Egypt,18-Jun-20,1956,TV-14,104 min,"Classic Movies, Dramas, International Movies"
Movie,Lola Igna,Eduardo Roy Jr.,"Angie Ferro, Yves Flores, Meryll Soriano, Maria Isabel Lopez, Royce Cabrera, Jojo Riguerra, Soliman Cruz, Armand Reyes",Philippines,18-Jun-20,2019,TV-14,114 min,"Comedies, International Movies"
Movie,One Take,Manatsanun Phanlerdwongsakul,BNK48,Thailand,18-Jun-20,2020,TV-G,86 min,"Documentaries, International Movies, Music & Musicals"
Movie,The Blazing Sun,Youssef Chahine,"Omar Sharif, Faten Hamama, Zaki Rostom, Farid Shawqy, Abdel-Wareth Asar, Menassa Fahmy, Abdelghany Kamar, Hamdy Gheith, Mohsen Hassanein, Rafeaa El Shal",Egypt,18-Jun-20,1954,TV-14,116 min,"Classic Movies, Dramas, International Movies"
Movie,The Nut Job,Peter Lepeniotis,"Will Arnett, Brendan Fraser, Gabriel Iglesias, Jeff Dunham, Liam Neeson, Katherine Heigl, Stephen Lang, Maya Rudolph, Sarah Gadon, James Rankin","Canada, South Korea, United States",18-Jun-20,2014,PG,85 min,"Children & Family Movies, Comedies"
Movie,Riding Faith,Paco Aguilar,"John Schneider, T.C. Stallings, Grace Van Dien, Marisa Brown, Jimmy Deshler",United States,17-Jun-20,2020,TV-PG,81 min,"Children & Family Movies, Dramas, Faith & Spirituality"
Movie,Last Flight to Abuja,Obi Emelonye,"Omotola Jalade-Ekeinde, Hakeem Kae-Kazim, Jim Iyke, Ali Nuhu, Jide Kosoko, Anthony Monjaro, Jennifer Oguzie, Uru Eke, Celine Loader","Nigeria, United Kingdom",16-Jun-20,2012,TV-14,76 min,"Dramas, International Movies"
Movie,The Darkness,Greg McLean,"Kevin Bacon, Radha Mitchell, David Mazouz, Lucy Fry, Matt Walsh, Jennifer Morrison, Parker Mack, Paul Reiser, Ming-Na Wen, Tara Lynne Barr",United States,16-Jun-20,2016,PG-13,92 min,"Horror Movies, Thrillers"
Movie,Underdogs,Juan José Campanella,"Ariana Grande, Nicholas Hoult, Matthew Morrison, Eugenio Derbez, Taran Killam, Bobby Moynihan, Bella Thorne, Jay Pharoah, Dan Patrick, Shawn Mendes, Brooklyn Beckham, Chazz Palminteri, John Leguizamo, Mel Brooks, Rupert Grint, Rob Brydon, Anthony Head, Ralf Little, Eve Ponsonby, Peter Serafinowicz, Alex Norton, Alistair McGowan, Ezequiel Cipols","Argentina, Spain",15-Jun-20,2013,PG,85 min,"Children & Family Movies, Sports Movies"
Movie,Wira,Adrian Teh,"Hairul Azreen, Fify Azmi, Ismi Melinda, Hilal Azman, Dain Said, Yayan Ruhian, Henley Hii, Josiah Hogan",Malaysia,15-Jun-20,2019,TV-14,108 min,"Action & Adventure, Dramas, International Movies"
Movie,Asura Guru,A. Raajdheep,"Vikram Prabhu, Subbaraju, Mahima Nambiar, Yogi Babu, Jagan",India,13-Jun-20,2020,TV-14,117 min,"Dramas, International Movies"
Movie,Milea,"Fajar Bustomi, Pidi Baiq","Iqbaal Ramadhan, Vanesha Prescilla, Ira Wibowo, Bucek, Happy Salma, Farhan, Maudy Koesnaedi, Jerome Kurnia",Indonesia,13-Jun-20,2020,TV-14,100 min,"Dramas, International Movies, Romantic Movies"
Movie,Okko's Inn,Kitaro Kosaka,"Seiran Kobayashi, Nana Mizuki, Satsumi Matsuda, Rina Endo, Etsuko Kozakura, Yoko Asagami, Teiyu Ichiryusai, Masaki Terasoma, Hirohide Yakumaru, Anju Suzuki, Osamu Shitara, Mikako Komatsu, Horan Chiaki, Koichi Yamadera, Fumiko Orikasa",Japan,12-Jun-20,2018,PG,96 min,"Anime Features, Children & Family Movies"
Movie,Menahi,Ayman Makram,"Fayez Al-Malki, Mona Wasef, Abdel Imam Abdullah, Reem Abdel Aziz, Dana Jabr, Emad Al Youssef, Remas Mansoor, Khalid Mengah",Saudi Arabia,11-Jun-20,2008,TV-14,101 min,"Comedies, International Movies"
TV Show,DC's Legends of Tomorrow,Rob Seidenglanz,"Victor Garber, Brandon Routh, Caity Lotz, Franz Drameh, Amy Pemberton, Dominic Purcell, Maisie Richardson-Sellers, Nick Zano, Arthur Darvill, Wentworth Miller, Tala Ashe, Adam Tsekhman, Christina Brucato, Simon Merrells, Nils Hognestad, Jes Macallan, Keiynan Lonsdale",United States,10-Jun-20,2020,TV-14,5 Seasons,"TV Action & Adventure, TV Sci-Fi & Fantasy"
Movie,Before I Fall,Ry Russo-Young,"Zoey Deutch, Halston Sage, Erica Tremblay, Logan Miller, Cynthy Wu, Kian Lawley, Jennifer Beals, Medalion Rahimi, Diego Boneta, Elena Kampouris, Liv Hewson, G. Hannelius, Nicholas Lea, Claire Margaret Corlett, Roan Curtis",United States,8-Jun-20,2017,PG-13,98 min,"Dramas, Romantic Movies"
Movie,Forensic,"Akhil Paul, Anas Khan","Tovino Thomas, Mamtha Mohandas, Renji Panicker, Saiju Kurup, Reba Monica John, Pratap Pothen, Giju John, Sreekanth Murali",India,7-Jun-20,2020,TV-14,132 min,"International Movies, Thrillers"
Movie,Project Papa,Kanika Batra,"Rakesh Batra, Kanika Batra, Sneha Kapoor, Rohn Malhotra, Munira Sen, Anaitha Nair, Rajit Kapoor",India,7-Jun-20,2018,TV-14,92 min,"Dramas, Independent Movies, International Movies"
Movie,Before the Summer Crowds,Mohamed Khan,"Maged El Kedwany, Hana Shiha, Ahmed Dawood, Lana Mushtak, Hany El Metennawy",Egypt,5-Jun-20,2016,TV-14,86 min,"Dramas, International Movies"
Movie,Big Stone Gap,Adriana Trigiani,"Ashley Judd, Patrick Wilson, Whoopi Goldberg, John Benjamin Hickey, Jane Krakowski, Judith Ivey, Jasmine Guy, Chris Sarandon, Anthony LaPaglia, Jenna Elfman, Angelina Fiordellisi, Mary Testa, Dagmara Dominczyk, Mary Pat Gleason, Joe Inscoe, James Hampton, Paul Wilson",United States,5-Jun-20,2014,PG-13,103 min,"Comedies, Romantic Movies"
Movie,Choked: Paisa Bolta Hai,Anurag Kashyap,"Saiyami Kher, Roshan Mathew, Amruta Subhash, Upendra Limaye, Tushar Dalvi, Rajshri Deshpande, Vaisnavi RP, Uday Nene, Parthveer Shukla, Sanjay Bhatia, Aditya Kumar, Milind Pathak",India,5-Jun-20,2020,TV-14,114 min,"Dramas, International Movies"
TV Show,Supernatural,Phil Sgriccia,"Jared Padalecki, Jensen Ackles, Mark Sheppard, Misha Collins, Jim Beaver, Andrea Menard, Samantha Smith, Mark Pellegrino, Alexander Calvert","United States, Canada",5-Jun-20,2019,TV-14,15 Seasons,"Classic & Cult TV, TV Action & Adventure, TV Horror"
Movie,Hot Sweet Sour,Andaç Haznedaroğlu,"Buğra Gülsoy, Özge Özpirinçci, Yusuf Akgün, Füsun Demirel, Gözde Türkpençe, Osman Alkaş, Rahmi Dilligil, Somer Karvan",Turkey,4-Jun-20,2017,TV-14,102 min,"Dramas, International Movies, Romantic Movies"
Movie,Andaleeb El Dokki,Wael Ehsan,"Mohamed Henedi, Heba Nour, Dawood Hussain, Amr Abdel-Geleel, Mohammed El Sadaany, Mohamed Sherif Hassan",Egypt,2-Jun-20,2008,TV-14,106 min,"Comedies, International Movies"
Movie,Let's Dance,Inas El-Degheidy,"Yousra, Tamer Hagras, Ezzat Abou Aouf, Hala Sedki, Marwan Azab",Egypt,2-Jun-20,2006,TV-14,116 min,"Comedies, Dramas, International Movies"
Movie,Life's Speed Bump,Wael Ehsan,"Ahmed Helmy, Nour, Ezzat Abou Aouf, Ahmed Rateb, Ahmed Saeed Abdel-Ghany, Menna Arafa",Egypt,2-Jun-20,2006,TV-14,109 min,"Comedies, International Movies"
Movie,Sorry To Disturb,Khaled Marei,"Ahmed Helmy, Mahmoud Hemeida, Menna Shalaby, Dalal Abdelaziz, Mohamed Sharaf, Tarek El Tilmisany, Mohammed El Sadaany, Samy Maghawry, Ahmed Fouad Selim, Ahmed Ramah",Egypt,2-Jun-20,2008,TV-14,116 min,"Dramas, International Movies"
Movie,The Student Cop,Wael Ihsan,"Karim Abdel Aziz, Hassan Hosny, Ghada Adel, Maha Ahmed, Ramez Galal, Mohamed Ragab, Mohamed El Dafrawy",Egypt,2-Jun-20,2004,TV-14,111 min,"Action & Adventure, Comedies, International Movies"
Movie,What's Up?,Izidore K. Musallam,"Hisham Abdulrahman, Turki Al-Yusuf, Mais Hamdan, Khaled Sami, Mishal Al-Mutairi, Hind Muhamed","Saudi Arabia, United Arab Emirates",2-Jun-20,2006,TV-PG,95 min,"Comedies, Dramas, International Movies"
Movie,X Large,Sherif Arafa,"Ahmed Helmy, Donia Samir Ghanim, Ibrahim Nasr, Yasmin Raeis, Saeed Tarabeek",Egypt,2-Jun-20,2011,TV-14,135 min,"Comedies, International Movies, Romantic Movies"
Movie,Chippa,Safdar Rahman,"Sunny Pawar, Chandan Roy Sanyal, Gautam Sarkar, Sumeet Thakur, Mala Mukherjee, Masood Akhtar, Veer Rajwant Singh, Joyraj Bhattacharya",India,1-Jun-20,2020,TV-14,92 min,"Comedies, Dramas, Independent Movies"
Movie,Cook Off,Tomas Brickhill,"Tendaiishe Chitima, Tendai Nguni, Jesese Mungoshi, Eddie Sandifolo, Charmaine Mujeri, Kudzai Sevenzo, Fungai Majaya, Eugene Zimbudzi, Chimwemwe Chipidza, Kevin Hanssen, Zihlo, Michael Kudakwashe",Zimbabwe,1-Jun-20,2017,TV-G,100 min,"Comedies, International Movies, Romantic Movies"
Movie,Kalek Shanab,Hani Al-Shaibani,"Saad Abdullah, Mohamed Alkendi, Ammar Rahma, Maria Khan, Msabeh Bin Hashim, Hani Abd Al Ghani, Zayed Mohammed Mahmoud, Khaled Abdullah",United Arab Emirates,1-Jun-20,2019,TV-PG,80 min,"Comedies, International Movies"
Movie,Mirai,Mamoru Hosoda,"Moka Kamishiraishi, Haru Kuroki, Gen Hoshino, Kumiko Aso, Mitsuo Yoshihara, Yoshiko Miyazaki, Koji Yakusho, Masaharu Fukuyama","Japan, United States",1-Jun-20,2018,PG,98 min,"Action & Adventure, Anime Features, Children & Family Movies"
Movie,The Stolen,Niall Johnson,"Alice Eve, Jack Davenport, Graham McTavish, Stan Walker, Richard O'Brien, Cohen Holloway, Stig Eldred, Emily Corcoran, Gillian MacGregor, Mikaela Ruegg","United Kingdom, Germany, United Arab Emirates, New Zealand",1-Jun-20,2016,TV-14,98 min,Dramas
Movie,High Strung Free Dance,Michael Damian,"Juliet Doherty, Thomas Doherty, Jane Seymour, Harry Jarvis, Joshua Sinclair-Evans, Ace Bhatti, Desmond Richardson, Kika Markham","Romania, United States",31-May-20,2019,TV-14,104 min,"Dramas, Music & Musicals, Romantic Movies"
Movie,Freej Al Taibeen,Ahmed Zain,"Ali Al Shehhi, Huda Al Ghanim, Muhammed Murshed, Yaser Alneyadi, Khaled Al-Nuaimi, Nasser Al-Dhahnani, Nawal Chamoun, Iman Husein",United Arab Emirates,29-May-20,2018,TV-PG,99 min,"Comedies, Dramas, International Movies"
Movie,Grandmother's Farm,Ahmed Zein,"Saeed Al-Sheryani, Yaser Alneyadi, Khaled Al-Nuaimi, Abdullah Al Hamiri, Abdullah Al-Ramsi, Muhammed Murshed, Meera Ali, Am Rashed, Amal Mohammed, Aisha Al Suwaidi",United Arab Emirates,28-May-20,2014,TV-14,71 min,"Comedies, Horror Movies, International Movies"
Movie,Grandmother's Farm Part 2,Ahmed Zein,"Mansour Al Felei, Saeed Al-Sheryani, Yaser Alneyadi, Khaled Al-Nuaimi, Abdullah Al Hamiri, Abdullah Al-Ramsi, Salama Almazrouei, Am Rashed, Aisha Al Suwaidi, Muhammed Murshed",United Arab Emirates,28-May-20,2015,TV-14,80 min,"Comedies, Horror Movies, International Movies"
Movie,Ne Zha,Yu Yang,"Lü Yanting, Joseph, Han Mo, Chen Hao, Lü Qi, Zhang Jiaming, Yang Wei",China,25-May-20,2019,TV-14,110 min,"Action & Adventure, Comedies, International Movies"
TV Show,Supergirl,Jesse Warn,"Melissa Benoist, Mehcad Brooks, Chyler Leigh, Jeremy Jordan, David Harewood, Calista Flockhart, Emma Tremblay, Adrian Pasdar, Katie McGrath, David St. Louis, Odette Annable, Floriana Lima, Erica Durance",United States,25-May-20,2019,TV-14,5 Seasons,"TV Action & Adventure, TV Sci-Fi & Fantasy"
Movie,One Day We'll Talk About Today,Angga Dwimas Sasongko,"Rachel Amanda, Rio Dewanto, Shelia Dara, Donny Damara, Susan Bachtiar, Oka Antara, Niken Anjani, Ardhito Pramono",Indonesia,23-May-20,2020,TV-G,128 min,"Dramas, International Movies"
Movie,Si Doel the Movie 3,Rano Karno,"Rano Karno, Cornelia Agatha, Maudy Koesnaedi, Suty Karno, Mandra Naih, Aminah Tjendrakasih, Rey Bong, Akhmad Zulhoir Mardia",Indonesia,23-May-20,2020,TV-G,93 min,"Dramas, International Movies, Music & Musicals"
Movie,Modest Heroes: Ponoc Short Films Theatre,"Hiromasa Yonebayashi, Yoshiyuki Momose, Akihiko Yamashita","Fumino Kimura, Rio Suzuki, Machiko Ono, Sota Shinohara, Kentaro Sakaguchi, Joe Odagiri, Min Tanaka",Japan,22-May-20,2018,PG,54 min,"Anime Features, Children & Family Movies"
Movie,#FriendButMarried,Rako Prijanto,"Adipati Dolken, Vanesha Prescilla, Rendi Jhon, Beby Tsabina, Denira Wiraguna, Refal Hady, Diandra Agatha, Sari Nila",Indonesia,21-May-20,2018,TV-G,102 min,"Dramas, International Movies, Romantic Movies"
Movie,Bye Bye London,Almunsif Alsuwaisi,"Abdulhussain Abdulredah, Ghanem Al-Saleh, Mariam Al-Ghadban, Dawood Hussain, Entesar Alsharah, Mohamed Gaber",Kuwait,21-May-20,1981,TV-14,177 min,"Comedies, Dramas, International Movies"
Movie,Mujeres arriba,Andrés Feddersen,"Loretto Bernal, Natalia Valdebenito, Alison Mandel, Matías Assler, Cristián Riquelme, Diego Casanueva, Samuel González, Consuelo Holzapfel, Esteban Rojas, Amanda Müller",Chile,21-May-20,2019,TV-14,98 min,"Comedies, International Movies, Romantic Movies"
Movie,No Longer kids,Samir Al Asfory,"Said Saleh, Hassan Moustafa, Ahmed Zaki, Younes Shalabi, Nadia Shukri, Karima Mokhtar",Egypt,21-May-20,1979,TV-14,237 min,"Comedies, Dramas, International Movies"
Movie,The Married Couples,Hassan AbdulSalam,"Samir Ghanem, George Sidhum, Sherine, Nagah El-Mogui",Egypt,21-May-20,1981,TV-14,195 min,"Comedies, International Movies, Romantic Movies"
Movie,The School of Mischief,Houssam El-Din Mustafa,"Suhair El-Babili, Adel Emam, Saeed Saleh, Younes Shalabi, Hadi El-Gayyar, Ahmad Zaki, Hassan Moustafa",Egypt,21-May-20,1973,TV-14,253 min,"Comedies, Dramas, International Movies"
Movie,The Witness Who Didn't See Anything,"Muhammad Fadl, Hany Motawie","Adel Imam, Nahed Gabr, Omar El-Hariri, Nazim Sharawy, Badr Nofal, Saeed Tarabeek, Hala Fakher, Samir Waley Eldein, Sami Gawhar, Shawqi Shamekh, Nasr Seif",Egypt,21-May-20,1976,TV-PG,157 min,"Comedies, International Movies"
Movie,Ben Platt Live from Radio City Music Hall,"Alex Timbers, Sam Wrench",Ben Platt,United States,20-May-20,2020,TV-PG,85 min,Music & Musicals
Movie,I Will Follow,Ava DuVernay,"Salli Richardson-Whitfield, Michole Briana White, Omari Hardwick, Tracie Thoms, Dijon Talton, Damone Roberts, Blair Underwood, Beverly Todd",United States,20-May-20,2010,TV-14,80 min,"Dramas, Independent Movies, Romantic Movies"
Movie,Either Me Or My Auntie,Saeed Hamed,"Mohamed Henedi, Donia Samir Ghanim, Hassan Hosny, Fadia Abdel Ghany, Alaa Morsy, Lotfy Labib, Nabil Issa, Hatem Jamel, Alaa Zinhom, Hala Sarhan",Egypt,19-May-20,2006,TV-PG,105 min,"Comedies, International Movies"
Movie,Escaping Tel Aviv,Sherif Arafa,"Karim Abdel Aziz, Mona Zaki, Sherif Mounir, Entsar, Salem Klass, Sabri Abdulmonem, Kinda Alloush, Yasser Ali Maher, Kamal Suliman, Jerjes Jbara",Egypt,19-May-20,2009,TV-14,120 min,"Action & Adventure, International Movies"
Movie,Game Over,Ahmed Al-Badry,"Yousra, Mai Ezz El-Din, Ezzat Abou Aouf, Mohamed Nour",Egypt,19-May-20,2012,TV-14,96 min,"Comedies, International Movies, Romantic Movies"
Movie,Karkar,Ali Ragab,"Mohamed Saad, Hassan Hosny, Ragaa Al-Geddawy, Yasmin Abdulaziz, Alaa Morsy",Egypt,19-May-20,2007,TV-14,107 min,"Comedies, International Movies"
Movie,My Sleeping Lover,Ahmad El-Badri,"Mai Ezz El-Din, Khaled Abol Naga, Hassan Hosny, Marwa Abdel Monem, Moustafa Haridy, Nahla Zaki, Ezzat Abou Aouf, Reda Hamed, Muhammad Qishta",Egypt,19-May-20,2008,TV-PG,93 min,"Comedies, International Movies"
Movie,Omar & Salma 2,Ahmad El-Badri,"Tamer Hosny, Mai Ezz El-Din, Ezzat Abou Aouf, Marwa Abdel Monem, Hussien Elgohary, Mirhan, Maysara",Egypt,19-May-20,2009,TV-14,101 min,"Comedies, International Movies"
Movie,Tarek's Situation,Wael Ehsan,"Ahmed Helmy, Nour, Majdi Kamel, Khaled El Sawy, Mais Hamdan, Moataza Abdel Sabour, Youssef Dawood, Youssef Fawzy, Mohamed Sharaf, Osama Munir",Egypt,19-May-20,2006,TV-14,110 min,"Comedies, International Movies, Romantic Movies"
Movie,The Beach Loafer,Ali Ragab,"Ahmed Helmy, Yasmin Abdulaziz, Mahmoud Abdel Moghny, Lotfy Labib, Soad Nasr, Rico, Ahmed Rateb, Youssef Eid",Egypt,19-May-20,2004,TV-14,112 min,"Comedies, International Movies"
Movie,Wadjda,Haifaa Al-Mansour,"Reem Abdullah, Waad Mohammed, Abdullrahman Al Gohani, Ahd, Sultan Al Assaf, Alanoud Sajini, Rafa Al Sanea, Dana Abdullilah","Saudi Arabia, Netherlands, Germany, Jordan, United Arab Emirates, United States",19-May-20,2012,PG,93 min,"Dramas, Independent Movies, International Movies"
Movie,Zaki Chan,Wael Ihsan,"Ahmed Helmy, Yasmin Abdulaziz, Hassan Hosny, Hasan Kami",Egypt,19-May-20,2005,TV-PG,109 min,"Comedies, International Movies, Romantic Movies"
Movie,Light in the Dark,Ekene Som Mekwunye,"Rita Dominic, Joke Silva, Ngozi Nwosu, Kiki Omeili, Kalu Ikeagwu, Emmanuel Essien, Saidi Balogun",Nigeria,18-May-20,2019,TV-14,105 min,"Dramas, International Movies"
Movie,Dilan 1990,"Fajar Bustomi, Pidi Baiq","Vanesha Prescilla, Iqbaal Ramadhan, Debo Andryos, Giulio Parengkuan, Omara Esteghlal, Yoriko Angeline, Zulfa Maharani, Brandon Salim",Indonesia,14-May-20,2018,TV-14,109 min,"Dramas, International Movies, Romantic Movies"
Movie,Dilan 1991,"Fajar Bustomi, Pidi Baiq","Iqbaal Ramadhan, Vanesha Prescilla, Ira Wibowo, Bucek Depp, Happy Salma, Farhan, Maudy Koesnaedi, Jerome Kurnia",Indonesia,14-May-20,2019,TV-14,118 min,"Dramas, International Movies, Romantic Movies"
Movie,Fan of Amoory,Salmeen AlMurry Amer,"AlMulla AbdulRahman, Mansour Al Felei, Abdullah Bin Heider, Alhamadi Hamad, Alzaabi Matar, AlBloushi Mayed, Althogali Saif, Alaa Shakir",United Arab Emirates,14-May-20,2018,TV-G,109 min,"Children & Family Movies, Dramas, International Movies"
