type,title,director,cast,country,date_added,release_year,rating,duration,genre
Movie,My Friend Pinto,Raaghav Dar,"Prateik, Kalki Koechlin, Arjun Mathur, Shruti Seth, Makrand Deshpande, Divya Dutta, Rajendranath Zutshi, Amin Hajee, Karim Hajee, Shakeel Khan",India,1-Oct-18,2011,TV-14,100 min,"Comedies, International Movies, Sci-Fi & Fantasy"
Movie,My Little Pony Equestria Girls: Forgotten Friendship,Ishi Rudell,"Ashleigh Ball, Andrea Libman, Rebecca Shoichet, Tabitha St. Germain, Tara Strong, Nicole Oliver",United States,1-Oct-18,2018,TV-Y,44 min,Children & Family Movies
Movie,My Little Pony Equestria Girls: Rollercoaster of Friendship,Ishi Rudell,"Ashleigh Ball, Andrea Libman, Rebecca Shoichet, Tabitha St. Germain, Tara Strong, Tegan Moss","United States, Canada",1-Oct-18,2018,TV-Y,44 min,Children & Family Movies
Movie,Naan Sigappu Manithan,Thiru,"Vishal, Lakshmi Menon, Saranya Ponvannan, Jayaprakash, Sunder Ramu, Jagan, Iniya, Chetan Cheenu",India,1-Oct-18,2014,TV-14,147 min,"Action & Adventure, Dramas, International Movies"
Movie,Nasha,Amit Saxena,"Shivam Patil, Poonam Pandey, Sheetal Singh, Vishal Bhosle, Rohan Khurana, Ranbir Chakma, Raj Kesaria, Chirag Lobo",India,1-Oct-18,2013,TV-14,115 min,"Dramas, International Movies, Romantic Movies"
Movie,Naughty Jatts,Pankaj Batra,"Neeru Bajwa, Binnu Dhillon, Arya Babbar, Roshan Prince, B.N. Sharma, Karamjit Anmol, Harby Sangha",India,1-Oct-18,2013,TV-PG,121 min,"Comedies, International Movies, Music & Musicals"
Movie,Needhi Singh,Jaivi Dhanda,"Kulraj Randhawa, Nirmal Rishi, Ashish Duggal, Aman Sutdhar, Dally Daljit, Seema Kaushal, Shubh Ghumman, Karan Tiwana",India,1-Oct-18,2016,TV-14,103 min,"Action & Adventure, Dramas, International Movies"
Movie,Peace Haven,Suman Ghosh,"Soumitra Chatterjee, Paran Banerjee, Arun Mukherjee, Sujan Mukherjee","India, United States",1-Oct-18,2016,TV-14,73 min,"Comedies, Dramas, Independent Movies"
Movie,Phantom,Kabir Khan,"Saif Ali Khan, Katrina Kaif, Sabyasachi Chakraborty, Mohammed Zeeshan Ayyub, Sohaila Kapoor, Denzil Smith",India,1-Oct-18,2015,TV-14,129 min,"Action & Adventure, International Movies"
Movie,Pizza,Akshay Akkineni,"Akshay Oberoi, Parvathy Omanakuttan, Arunoday Singh, Dipannita Sharma, Rajesh Sharma, Omkar Das Manikpuri, Hussain Dalal, D. Santosh",India,1-Oct-18,2014,TV-14,102 min,"Horror Movies, International Movies, Thrillers"
Movie,Pooja Kiven Aa,Nidhi Sharma,"Miss Pooja, Tarun Khanna, Raj Singh Jhinger, Sahil Vedoliyaa, B.N. Sharma, Manoj Joshi, Anita Shabdeesh, Sardar Sohi",India,1-Oct-18,2013,TV-PG,122 min,"Comedies, International Movies, Music & Musicals"
Movie,Race,"Mastan Alibhai Burmawalla, Abbas Alibhai Burmawalla","Saif Ali Khan, Akshaye Khanna, Katrina Kaif, Bipasha Basu, Anil Kapoor, Sameera Reddy",India,1-Oct-18,2008,TV-14,155 min,"Action & Adventure, International Movies, Music & Musicals"
Movie,Race 2,"Abbas Alibhai Burmawalla, Mastan Alibhai Burmawalla","Anil Kapoor, Saif Ali Khan, John Abraham, Deepika Padukone, Jacqueline Fernandez, Ameesha Patel, Rajesh Khattar, Chunky Pandey",India,1-Oct-18,2013,TV-14,139 min,"Action & Adventure, International Movies, Music & Musicals"
Movie,Saadey CM Saab,Vipin Parashar,"Harbhajan Mann, Kashish Singh, Gurpreet Guggi, Rahul Singh, Dev Gill, Inder Bajwa",India,1-Oct-18,2015,TV-PG,131 min,"Comedies, Dramas, International Movies"
Movie,Sat Shri Akaal England,Vikram Pradhan,"Ammy Virk, Monica Gill, Karamjit Anmol, Sardar Sohi, Jarnail Singh, Satwant Kaur, Harby Sangha, Baljinder Darapuri",India,1-Oct-18,2017,TV-14,127 min,"Comedies, Dramas, International Movies"
Movie,Thaandavam,Vijay,"Vikram, Jagapathi Babu, Anushka Shetty, Amy Jackson, Lakshmi Rai, Santhanam, Nasser, Saranya Ponvannan",India,1-Oct-18,2012,TV-14,156 min,"Action & Adventure, International Movies, Music & Musicals"
Movie,Theeya Velai Seyyanum Kumaru,Sundar C.,"Siddarth, Santhanam, Hansika Motwani, Ganesh Venkatraman, RJ Balaji, Bosskey, Manobala, Chitra Lakshmanan",India,1-Oct-18,2013,TV-PG,132 min,"Comedies, International Movies, Music & Musicals"
Movie,Tiger,Sartaj Singh Pannu,"Sippy Gill, Ihana Dhillon, Yograj Singh, Yashpal Sharma, Deedar GIll, Rahul Jugraj, Virender Nath Lubana, Aneeta",India,1-Oct-18,2016,TV-14,130 min,"Action & Adventure, Dramas, International Movies"
Movie,Vettai,N. Linguswamy,"Arya, Madhavan, Sameera Reddy, Amala Paul, Nasser, Ashutosh Rana, Sreejith Ravi, Muthukumar",India,1-Oct-18,2012,TV-14,156 min,"Action & Adventure, International Movies, Music & Musicals"
Movie,Wake Up Sid,Ayaan Mukherji,"Ranbir Kapoor, Konkona Sen Sharma, Shruti Bapna, Krutika Bolaki, Namit Das, Munir Kabani, Mohsin Ali Khan, Anupam Kher, Rahul Khanna, Kainaz Motivala",India,1-Oct-18,2009,TV-14,132 min,"Comedies, International Movies, Romantic Movies"
Movie,We Are Family,Sidharth Malhotra,"Kajol, Kareena Kapoor, Arjun Rampal, Nominath Ginsberg, Iravati Harshe, Aachal Munjal, Diya Sonecha","India, Australia",1-Oct-18,2010,TV-14,119 min,"Dramas, International Movies"
Movie,What the Jatt!!,Saket Behl,"Harish Verma, Isha Rikhi, Vipul Roy, Binnu Dhillon, Poonam Rajput, B.N. Sharma, Satti Sembi",India,1-Oct-18,2015,TV-PG,140 min,"Comedies, International Movies, Romantic Movies"
Movie,Zindagi Kitni Haseen Hay,Anjum Shahzad,"Feroze Khan, Sajal Ali, Jibrayl Ahmed Rajput, Alyy Khan, Shafqat Cheema, Nayyar Ejaz, Rashid Farooqi",Pakistan,1-Oct-18,2016,TV-14,126 min,"Dramas, International Movies, Romantic Movies"
Movie,Big Miracle,Ken Kwapis,"Drew Barrymore, John Krasinski, Kristen Bell, Dermot Mulroney, Tim Blake Nelson, Vinessa Shaw, Ted Danson, Stephen Root, Rob Riggle, Michael Gaston","United States, United Kingdom",30-Sep-18,2012,PG,107 min,"Children & Family Movies, Dramas"
Movie,Next Gen,"Kevin R. Adams, Joe Ksander","John Krasinski, Charlyne Yi, Jason Sudeikis, Michael Peña, David Cross, Constance Wu","China, Canada, United States",7-Sep-18,2018,TV-PG,106 min,"Children & Family Movies, Comedies, Sci-Fi & Fantasy"
Movie,Sierra Burgess Is A Loser,Ian Samuels,"Shannon Purser, Kristine Froseth, RJ Cyler, Noah Centineo, Loretta Devine, Giorgia Whigham, Alice Lee, Lea Thompson, Alan Ruck, Mary Pat Gleason, Chrissy Metz",United States,7-Sep-18,2018,PG-13,106 min,"Comedies, Romantic Movies"
Movie,PK,Rajkumar Hirani,"Aamir Khan, Anuskha Sharma, Sanjay Dutt, Saurabh Shukla, Parikshat Sahni, Sushant Singh Rajput, Boman Irani, Rukhsar",India,6-Sep-18,2014,TV-14,146 min,"Comedies, Dramas, International Movies"
Movie,​​Kuch Bheege Alfaaz,Onir,"Geetanjali Thapa, Zain Khan Durrani, Shray Rai Tiwari, Mona Ambegaonkar, Chandreyee Ghosh, Barun Chanda, Saheb Bhattacharjee, Shefali Chauhan",India,1-Sep-18,2018,TV-14,110 min,"Dramas, Independent Movies, International Movies"
Movie,Once Again,Kanwal Sethi,"Shefali Shah, Neeraj Kabi, Rasika Dugal, Bidita Bag, Priyanshu Painyuli, Bhagwan Tiwari","India, Germany, Austria",1-Sep-18,2018,TV-PG,101 min,"Dramas, Independent Movies, International Movies"
Movie,Naam Shabana,Shivam Nair,"Tapsee Pannu, Akshay Kumar, Manoj Bajpayee, Prithviraj Sukumaran, Danny Denzongpa, Anupam Kher, Zakir Hussain, Virendra Saxenda",India,28-Aug-18,2017,TV-14,141 min,"Action & Adventure, International Movies"
Movie,Qarib Qarib Singlle,Tanuja Chandra,"Irrfan Khan, Parvathy, Neha Dhupia, Pushtii Shakti, Luke Kenny, Siddharth Menon, Bajrangbali Singh, Brijendra Kala",India,28-Aug-18,2017,TV-14,120 min,"Comedies, International Movies, Romantic Movies"
Movie,Spyder,A.R. Murugadoss,"Mahesh Babu, Rakul Preet Singh, S.J. Surya, Bharath Srinivasan, Priyadarshi Pullikonda, RJ Balaji",India,28-Aug-18,2017,TV-14,140 min,"Action & Adventure, International Movies"
TV Show,Take My Brother Away,Han Qing,"Sun Qian, Joseph Zeng, Lv Xiao Yu, Hu Yong Tao, Wang Xu Dong, Ma Bai Quan",China,24-Aug-18,2018,TV-14,1 Season,"International TV Shows, TV Comedies, TV Dramas"
Movie,Bareilly Ki Barfi,Ashwiny Iyer Tiwari,"Ayushmann Khurrana, Kriti Sanon, Rajkummar Rao, Pankaj Tripathi, Seema Pahwa, Rohit Chaudhury, Swati Semwal",India,21-Aug-18,2017,TV-14,110 min,"Comedies, Dramas, International Movies"
Movie,Mersal,Atlee Kumar,"Joseph Vijay, S.J. Surya, Kajal Aggarwal, Samantha Ruth Prabhu, Nithya Menon, Vadivelu, Sathyaraj",India,21-Aug-18,2017,TV-14,162 min,"Action & Adventure, Dramas, International Movies"
Movie,Mom,Ravi Udyawar,"Sridevi, Akshaye Khanna, Sajal Ali, Nawazuddin Siddiqui, Adnan Siddiqui, Pitobash, Abhimanyu Singh, Vikas Verma",India,21-Aug-18,2017,TV-14,139 min,"Dramas, International Movies, Thrillers"
Movie,Pad Man,R. Balki,"Akshay Kumar, Sonam Kapoor, Radhika Apte, Jyoti Subhash, Urmila Mahanta, Suneel Sinha, Sanjay Singh, Rakesh Chaturvedi Om",India,21-Aug-18,2018,PG-13,130 min,"Dramas, International Movies, Romantic Movies"
Movie,Toilet: Ek Prem Katha,Shree Narayan Singh,"Akshay Kumar, Bhumi Pednekar, Divyendu Sharma, Atul Srivastava, Anupam Kher, Ayesha Raza Mishra, Mukesh S Bhatt, Shubha Khote, Sudhir Pandey",India,21-Aug-18,2017,TV-14,145 min,"Comedies, Dramas, International Movies"
Movie,To All the Boys I’ve Loved Before,Susan Johnson,"Lana Condor, Noah Centineo, Janel Parrish, Anna Cathcart, Andrew Bachelor, Trezzo Mahoro, Madaleine Arthur, Israel Broussard, Emilija Baranac, John Corbett",United States,17-Aug-18,2018,TV-14,100 min,"Comedies, International Movies, Romantic Movies"
Movie,Bhavesh Joshi Superhero,Vikramaditya Motwane,"Harshvardhan Kapoor, Priyanshu Painyuli, Ashish Verma, Shreiya Sabharwal, Pratap Phad, Chinmayee Mandlekar, Nishikant Kamat, Hrishikesh Joshi",India,16-Aug-18,2018,TV-14,150 min,"Dramas, International Movies, Sci-Fi & Fantasy"
Movie,The Guernsey Literary and Potato Peel Pie Society,Mike Newell,"Lily James, Michiel Huisman, Penelope Wilton, Tom Courtenay, Jessica Brown Findlay, Katherine Parkinson, Matthew Goode","United Kingdom, France, United States",10-Aug-18,2018,TV-PG,124 min,"Dramas, Romantic Movies"
Movie,Zion,Floyd Russ,Zion Clark,United States,10-Aug-18,2018,TV-PG,12 min,"Documentaries, Sports Movies"
Movie,2 States,Abhishek Varman,"Alia Bhatt, Arjun Kapoor, Ronit Roy, Amrita Singh, Revathy, Aru Krishansh Verma",India,4-Aug-18,2014,TV-PG,143 min,"Comedies, Dramas, International Movies"
Movie,Baaghi,Sabir Khan,"Tiger Shroff, Shraddha Kapoor, Sudheer Babu, Paras Arora, Sunil Grover, Sourav Chakraborty, Shaurya Bhardawaj",India,4-Aug-18,2016,TV-14,127 min,"Action & Adventure, International Movies"
Movie,Flavors of Youth: International Version,"Xiaoxing Yi, Yoshitaka Takeuchi, Haoling Li","Taito Ban, Mariya Ise, Minako Kotobuki, Haruka Shiraishi, Hiroki Yasumoto, Takeo Otsuka, Ikumi Hasegawa, Takayuki Nakatsukasa","China, Japan",4-Aug-18,2018,TV-PG,74 min,"Anime Features, International Movies, Romantic Movies"
Movie,Chillar Party,"Vikas Bahl, Nitesh Tiwari","Irfan Khan, Raju, Sanath Menon, Rohan Grover, Naman Jain, Aarav Khanna, Vishesh Tiwari, Chinmai Chandranshuh, Vedant Desai, Shriya Sharma, Divji Handa",India,2-Aug-18,2011,TV-PG,127 min,"Children & Family Movies, Comedies, Dramas"
Movie,Fitoor,Abhishek Kapoor,"Aditya Roy Kapoor, Katrina Kaif, Tabu, Rahul Bhatt, Lara Dutta, Akshay Oberoi, Aditi Rao Hydari, Ajay Devgn",India,2-Aug-18,2016,TV-14,124 min,"Dramas, International Movies, Romantic Movies"
Movie,Fiza,Khalid Mohamed,"Karisma Kapoor, Jaya Bhaduri, Hrithik Roshan, Neha, Asha Sachdev, Bikram Saluja, Isha Koppikar, Johny Lever, Sushmita Sen, Manoj Bajpayee",India,2-Aug-18,2000,TV-14,163 min,"Dramas, International Movies, Music & Musicals"
Movie,Guzaarish,Sanjay Leela Bhansali,"Hrithik Roshan, Aishwarya Rai Bachchan, Shernaz Patel, Aditya Roy Kapoor, Nafisa Ali, Monikangana Dutta, Suhel Seth, Rajit Kapoor, Ash Chandler, Vijay Crishna",India,2-Aug-18,2010,TV-14,121 min,"Dramas, International Movies"
Movie,Highway,Imtiaz Ali,"Randeep Hooda, Alia Bhatt, Durgesh Kumar, Pradeep Nagar",India,2-Aug-18,2014,TV-14,127 min,"Action & Adventure, Dramas, International Movies"
Movie,I Hate Luv Storys,Punit Malhotra,"Imran Khan, Sonam Kapoor, Sammir Dattani, Samir Soni, Kavin Dave, Bruna Abdullah",India,2-Aug-18,2010,TV-14,128 min,"Comedies, International Movies, Music & Musicals"
Movie,Joker,Shirish Kunder,"Akshay Kumar, Sonakshi Sinha, Shreyas Talpade, Minissha Lamba, Pitobash, Darshan Jariwala, Alexx O'Nell, Asrani, Sanjay Mishra, Vrijesh Hirjee",India,2-Aug-18,2012,TV-PG,98 min,"Comedies, International Movies, Music & Musicals"
Movie,Main aurr Mrs. Khanna,Prem Soni,"Salman Khan, Kareena Kapoor, Sohail Khan, Preity Zinta, Bappi Lahiri, Yash Tonk, Nauheed Cyrusi, Mahek Chahal",India,2-Aug-18,2009,TV-14,109 min,"International Movies, Music & Musicals, Romantic Movies"
Movie,Mohenjo Daro,Ashutosh Gowariker,"Hrithik Roshan, Sonakshi Sinha, Pooja Hegde, Kabir Bedi, Arunoday Singh, Kishori Shahane, Narendra Jha, Nitish Bharadwaj",India,2-Aug-18,2016,TV-14,168 min,"Action & Adventure, Dramas, International Movies"
Movie,Raajneeti,Prakash Jha,"Ajay Devgn, Nana Patekar, Ranbir Kapoor, Katrina Kaif, Arjun Rampal, Manoj Bajpayee, Sarah Thompson, Naseeruddin Shah",India,2-Aug-18,2010,TV-14,162 min,"Dramas, International Movies, Thrillers"
Movie,Rang De Basanti,Rakeysh Omprakash Mehra,"Aamir Khan, Siddharth, Atul Kulkarni, Sharman Joshi, Kunal Kapoor, Alice Patten, Soha Ali Khan, Waheeda Rehman, Kiron Kher, Om Puri, Anupam Kher, Madhavan",India,2-Aug-18,2006,TV-14,159 min,"Dramas, International Movies"
Movie,Rowdy Rathore,Prabhu Deva,"Akshay Kumar, Sonakshi Sinha, Nasser, Yashpal Sharma, Paresh Ganatra, Gurdip Kohli, Mushtaq Khan, Amit Kumar Tiwari",India,2-Aug-18,2012,TV-14,137 min,"Action & Adventure, Comedies, International Movies"
Movie,Tamasha,Imtiaz Ali,"Ranbir Kapoor, Deepika Padukone, Piyush Mishra, Javed Sheikh, Nikhil Bhagat, Faraaz Servaia",India,2-Aug-18,2015,TV-14,133 min,"Dramas, International Movies, Romantic Movies"
Movie,Tere Naal Love Ho Gaya,Mandeep Kumar,"Riteish Deshmukh, Genelia D'Souza, Tinnu Anand, Om Puri, Smita Jaykar, Chitrashi Rawat, Navin Prabhakar, Kartar Cheema",India,2-Aug-18,2012,TV-14,127 min,"Comedies, International Movies, Romantic Movies"
Movie,Thank You,Anees Bazmee,"Akshay Kumar, Bobby Deol, Sonam Kapoor, Irrfan Khan, Sunil Shetty, Rimi Sen, Celina Jaitly",India,2-Aug-18,2011,TV-14,131 min,"Comedies, International Movies, Romantic Movies"
Movie,The Blue Umbrella,Vishal Bhardwaj,"Pankaj Kapur, Shreya Sharma, Dolly Ahluwalia, Deepak Dobriyal, Rahul Kumar, Paramjit Singh Kakran, Piu Dutt, Samrat Mukherjee",India,2-Aug-18,2005,TV-PG,90 min,"Children & Family Movies, Dramas, Independent Movies"
Movie,Da Kath & Kim Code,Ted Emery,"Jane Turner, Gina Riley, Glenn Robbins, Peter Rowsthorn, Magda Szubanski",Australia,28-Jul-18,2005,TV-PG,82 min,Movies
Movie,Kath & Kimderella,Ted Emery,"Jane Turner, Gina Riley, Magda Szubanski, Glenn Robbins, Peter Rowsthorn, Rob Sitch, Richard E. Grant, Barry Humphries, Erin Mullally, Jessica De Gouw",Australia,28-Jul-18,2012,TV-14,86 min,Comedies
Movie,Parmanu: The Story of Pokhran,Abhishek Sharma,"John Abraham, Boman Irani, Diana Penty, Anuja Sathe, Yogendra Tikku, Aditya Hitkari, Vikas Kumar, Ajay Shankar, Darshan Pandya, Mark Benington",India,25-Jul-18,2018,TV-PG,124 min,"Dramas, International Movies"
Movie,Duck Duck Goose,Chris Jenkins,"Jim Gaffigan, Zendaya, Lance Lim, Greg Proops, Reggie Watts, Carl Reiner, Jennifer Grey, Stephen Fry, Diedrich Bader, Natasha Leggero, Craig Ferguson, Rick Overton","China, United States, United Kingdom",20-Jul-18,2018,PG,92 min,"Children & Family Movies, Comedies"
Movie,Nothing to Lose,Alexandre Avancini,"Petrônio Gontijo, Day Mesquita, Beth Goulart, Dalton Vigh, Eduardo Galvão, André Gonçalves, Marcello Airoldi",Brazil,20-Jul-18,2018,PG,133 min,"Dramas, Faith & Spirituality, International Movies"
Movie,Camarón: The Film,Alexis Morante,Juan Diego,Spain,18-Jul-18,2018,TV-14,105 min,"Documentaries, International Movies, Music & Musicals"
Movie,GODZILLA City on the Edge of Battle,"Kobun Shizuno, Hiroyuki Seshita","Mamoru Miyano, Takahiro Sakurai, Kana Hanazawa, Tomokazu Sugita, Yuki Kaji, Junichi Suwabe, Reina Ueda, Ari Ozawa, Daisuke Ono, Kenta Miyake, Kenyu Horiuchi, Kazuya Nakai, Kazuhiro Yamaji",Japan,18-Jul-18,2018,TV-14,101 min,"Action & Adventure, Anime Features, International Movies"
Movie,Going for Gold,Clay Glen,"Kelli Berglund, Emily Morris, Terry Rogers, Jess Kuss, Jo Stone, Elysia Markou, Daisy Anderson, Ruth Natalie Fallon, Henry Turczynowicz, Martha Lott",Australia,15-Jul-18,2018,TV-G,88 min,"Children & Family Movies, Dramas, International Movies"
Movie,Luciano Mellera: Infantiloide,"Raúl Campos, Jan Suter",Luciano Mellera,Argentina,6-Jul-18,2018,TV-14,66 min,Stand-Up Comedy
Movie,The Legacy of a Whitetail Deer Hunter,Jody Hill,"Josh Brolin, Danny McBride, Montana Jordan, Scoot McNairy, Carrie Coon",United States,6-Jul-18,2018,TV-14,83 min,"Action & Adventure, Comedies, Dramas"
Movie,White Fang,Alexandre Espigares,"Nick Offerman, Rashida Jones, Paul Giamatti, Eddie Spears, David Boat, Sean Kenin, Raquel Antonia, Daniel Hagen, Stephen Kramer Glickman, William Calvert, Jason Grasl, Armando Riesco","France, Luxembourg, United States",6-Jul-18,2018,TV-PG,88 min,"Children & Family Movies, Dramas"
Movie,King of Peking,Sam Voutas,"Zhao Jun, Wang Naixun, Han Qing, Si Chao, Geng Bowen, Yi Long","China, United States, Australia",2-Jul-18,2018,TV-14,88 min,"Comedies, Dramas, International Movies"
Movie,Anthony Kaun Hai?,Raj Kaushal,"Sanjay Dutt, Arshad Warsi, Minissha Lamba, Raghuvir Yadav, Anusha Dhandekar, Gulshan Grover, Ravi Baswani",India,1-Jul-18,2006,TV-14,122 min,"Comedies, Dramas, International Movies"
Movie,Chalte Chalte,Aziz Mirza,"Shah Rukh Khan, Rani Mukerji, Jas Arora, Satish Shah, Rajiv Verma, Lillete Dubey, Jayshree T., Johny Lever",India,1-Jul-18,2003,TV-14,166 min,"Dramas, International Movies, Romantic Movies"
Movie,Deewana Main Deewana,K.C. Bokadia,"Govinda, Priyanka Chopra, Kader Khan, Prem Chopra, Shakti Kapoor, Sharat Saxena, Himani Shivpuri, Johnny Lever",India,1-Jul-18,2013,TV-14,107 min,"Comedies, Dramas, International Movies"
Movie,I Am Kalam,Nila Madhab Panda,"Gulshan Grover, Harsh Mayar, Pitobash, Hussan Saad, Beatrice Ordeix, Sanjay Chauhan",India,1-Jul-18,2010,TV-PG,87 min,"Children & Family Movies, Comedies, Dramas"
Movie,My Birthday Song,Samir Soni,"Sanjay Suri, Nora Fatehi, Zenia Starr, Suparna Krishna, Elena Kazan",India,1-Jul-18,2018,TV-14,92 min,"Dramas, International Movies, Thrillers"
Movie,Namastey London,Vipul Amrutlal Shah,"Akshay Kumar, Katrina Kaif, Rishi Kapoor, Upen Patel, Javed Sheikh, Nina Wadia, Clive Standen, Tiffany Mulheron",India,1-Jul-18,2007,TV-14,130 min,"Comedies, Dramas, International Movies"
Movie,Soul Robbers,Juan Antonio de la Riva,"Sofía Sisniega, Natasha Dupeyron, Ana Sofía Durán, Javier Escobar, Luis Gatica, Juan Ángel Esparza, Jorge Luis Moreno, Arnulfo Reyes Sanchez, Tizoc Arroyo, José Enot, Ricardo Dalmacci, Harding Junior, Claudine Sosa, Pablo Valentín",Mexico,1-Jul-18,2015,TV-14,88 min,"Horror Movies, International Movies"
Movie,Tum Milo Toh Sahi,Kabir Sadanand,"Nana Patekar, Dimple Kapadia, Sunil Shetty, Vidya Malvade, Rehan Khan, Anjana Sukhani, Mohnish Bahl, Vrajesh Hirjee",India,1-Jul-18,2010,TV-14,128 min,"Comedies, Dramas, International Movies"
Movie,Penalty Kick,Rodrigo Triana,"Adrián Uribe, Julieth Restrepo, Carlos Manuel Vesga, José Sefami, Mary Paz Mata, Alicia Sandoval, Teresa Monroy, Eduardo Ibarrola","Colombia, Mexico",29-Jun-18,2018,TV-14,89 min,"Comedies, Dramas, International Movies"
Movie,Brain on Fire,Gerard Barrett,"Chloë Grace Moretz, Thomas Mann, Richard Armitage, Jenny Slate, Carrie-Anne Moss, Tyler Perry, Alex Zahara","United States, Canada, Ireland",22-Jun-18,2016,PG-13,89 min,"Dramas, Independent Movies, International Movies"
Movie,Sunday's Illness,Ramón Salazar,"Bárbara Lennie, Susi Sánchez, Miguel Ángel Solá, Richard Bohringer",Spain,15-Jun-18,2017,PG-13,113 min,"Dramas, Independent Movies, International Movies"
Movie,B.A. Pass 2,Shadab Khan,"Kritika Sachdeva, Sasho, Sanghmitra Hitaishi, Indraneil Sengupta, Saurabh Dubey, Shubhangi Latkar, Sukhbir Kaur Lamba, Arav Chowdharry",India,1-Jun-18,2017,TV-14,126 min,"Dramas, International Movies"
Movie,Steve Martin and Martin Short: An Evening You Will Forget for the Rest of Your Life,Marcus Raboy,"Steve Martin, Martin Short",United States,25-May-18,2018,TV-14,74 min,Stand-Up Comedy
Movie,Tig Notaro Happy To Be Here,Tig Notaro,Tig Notaro,United States,22-May-18,2018,TV-14,58 min,Stand-Up Comedy
Movie,Lupin the 3rd: The Castle of Cagliostro: Special Edition,Hayao Miyazaki,"Yasuo Yamada, Kiyoshi Kobayashi, Eiko Masuyama, Makio Inoue, Goro Naya, Sumi Shimamoto, Taro Ishida, Kohei Miyauchi, Ichiro Nagai",Japan,15-May-18,1979,PG-13,100 min,"Action & Adventure, Anime Features, Classic Movies"
Movie,The Kissing Booth,Vince Marcello,"Joey King, Joel Courtney, Jacob Elordi, Molly Ringwald","United Kingdom, United States",11-May-18,2018,TV-14,105 min,"Comedies, Romantic Movies"
Movie,My Fuhrer,Dani Levy,"Helge Schneider, Ulrich Mühe, Sylvester Groth, Adriana Altaras, Stefan Kurt, Ulrich Noethen, Lambert Hamel, Udo Kroschwald, Torsten Michaelis, Axel Werner",Germany,7-May-18,2007,TV-14,91 min,"Comedies, International Movies"
Movie,Pup Star: World Tour,Robert Vince,"Jed Ress, Makenzie Moss, Denisse Ojeda, Reggie De Leon, David DeLuise, Kaitlyn Maher, Jorge Diaz, George Newbern, Diedrich Bader, Mackenzie Sol","Canada, Japan, United States",5-May-18,2018,G,87 min,"Children & Family Movies, Comedies, Music & Musicals"
Movie,Lo más sencillo es complicarlo todo,Rene Bueno,"Danna Paola, Marjorie De Sousa, Alosian Vivancos, Daniela Wong, Lalo Brito, Eduardo Tanús, Paulina Matos, Fernando Sarfati, Lorena San Martín, Consuelo Vega",Mexico,4-May-18,2018,TV-14,94 min,"Comedies, International Movies, Romantic Movies"
Movie,CIA: Comrade in America,Amal Neerad,"Dulquer Salmaan, Karthika Muraleedharan, Siddique, Soubin Shahir, Dileesh Pothan, John Vijay, Chandini Sreedharan, Jinu Joseph, Sujith Shankar, Alencier Ley Lopez",India,1-May-18,2017,TV-14,130 min,"Action & Adventure, Dramas, Independent Movies"
Movie,My Perfect Romance,Justin G. Dyck,"Kimberly-Sue Murray, Christopher Russell, Lauren Holly, Jodie Sweetin, Morgan Fairchild",Canada,1-May-18,2018,PG,92 min,"Comedies, International Movies, Romantic Movies"
Movie,Pocoyo & The Space Circus,Alfonso Rodríguez,"Stephen Fry, Carys Doyle",Spain,1-May-18,2008,TV-Y,25 min,Movies
Movie,Sometimes,Priyadarshan,"Prakash Raj, Shreya Reddy, Ashok Selvan",India,1-May-18,2016,TV-14,101 min,"Dramas, International Movies"
Movie,Running Shaadi,Amit Roy,"Amit Sadh, Tapsee Pannu, Arsh Bajwa, Brijendra Kala, Mahavir Bhullar, Pankaj Jha, Neeta Mohindra",India,30-Apr-18,2017,TV-14,115 min,"Comedies, International Movies, Romantic Movies"
Movie,Candy Jar,Ben Shelton,"Christina Hendricks, Helen Hunt, Uzo Aduba, Sami Gayle, Jacob Latimore",United States,27-Apr-18,2018,TV-14,93 min,"Children & Family Movies, Dramas, Romantic Movies"
Movie,The Week Of,Robert Smigel,"Adam Sandler, Chris Rock, Steve Buscemi, Rachel Dratch, Allison Strong, Roland Buck III, Katie Hartman, Chloe Himmelman, Jake Lippmann, Jim Barone, June Gable",United States,27-Apr-18,2018,TV-14,117 min,Comedies
Movie,Bill Nye: Science Guy,"Jason Sussberg, David Alvarado","Bill Nye, Neil deGrasse Tyson, Eugenie Scott, Francis Collins, Ann Druyan",United States,25-Apr-18,2017,TV-PG,97 min,Documentaries
Movie,Fishtronaut: The Movie,"Célia Catunda, Kiko Mistrorigo, Rodrigo Eba","Fábio Lucindo, Celso Alves, Fernanda Bullara",Brazil,25-Apr-18,2018,TV-Y,78 min,Children & Family Movies
Movie,Kevin James: Never Don't Give Up,Andy Fickman,Kevin James,United States,24-Apr-18,2018,TV-PG,62 min,Stand-Up Comedy
Movie,Come Sunday,Joshua Marston,"Chiwetel Ejiofor, Martin Sheen, Danny Glover, Jason Segel, Condola Rashad, Lakeith Stanfield, Stacey Sargeant, Vondie Curtis-Hall",United States,13-Apr-18,2018,TV-14,105 min,"Dramas, Faith & Spirituality, Independent Movies"
Movie,Orbiter 9,Hatem Khraiche,"Clara Lago, Alex Gonzalez, Andrés Parra, Belén Rueda","Spain, Colombia",6-Apr-18,2017,TV-14,95 min,"Dramas, International Movies, Sci-Fi & Fantasy"
Movie,"Ram Dass, Going Home",Derek Peck,Ram Dass,United States,6-Apr-18,2018,TV-14,32 min,"Documentaries, Faith & Spirituality"
Movie,A Sort of Family,Diego Lerman,"Bárbara Lennie, Daniel Aráoz, Claudio Tolcachir, Paula Cohen, Yanina Ávila","Argentina, Brazil, France, Poland, Germany, Denmark",1-Apr-18,2017,TV-14,96 min,"Dramas, International Movies, Thrillers"
Movie,Billu,Priyadarshan,"Irrfan Khan, Shah Rukh Khan, Lara Dutta, Rajpal Yadav, Om Puri, Asrani, Manoj Joshi",India,1-Apr-18,2009,TV-PG,132 min,"Dramas, International Movies"
Movie,Main Hoon Na,Farah Khan,"Shah Rukh Khan, Sunil Shetty, Sushmita Sen, Zayed Khan, Amrita Rao, Kiron Kher, Boman Irani, Bindu, Naseeruddin Shah, Kabir Bedi",India,1-Apr-18,2004,TV-14,171 min,"Action & Adventure, Comedies, Dramas"
Movie,Metro,Ananda Krishnan,"Yogi Babu, Bobby Simha, Shirish",India,1-Apr-18,2016,TV-14,116 min,"Dramas, International Movies, Thrillers"
Movie,Om Shanti Om,Farah Khan,"Shah Rukh Khan, Deepika Padukone, Shreyas Talpade, Arjun Rampal, Kirron Kher, Javed Sheikh",India,1-Apr-18,2007,TV-14,169 min,"Comedies, Dramas, International Movies"
Movie,Paheli,Amol Palekar,"Shah Rukh Khan, Rani Mukerji, Anupam Kher, Dilip Prabhavalkar, Amitabh Bachchan, Juhi Chawla, Nina Kulkarni, Rajpal Yadav",India,1-Apr-18,2005,TV-PG,134 min,"Dramas, International Movies, Romantic Movies"
Movie,Phir Bhi Dil Hai Hindustani,Aziz Mirza,"Shah Rukh Khan, Juhi Chawla, Paresh Rawal, Satish Shah, Dilip Tahil, Govind Namdeo, Smita Jaykar, Shakti Kapoor, Johnny Lever",India,1-Apr-18,2000,TV-14,159 min,"Comedies, Dramas, International Movies"
TV Show,James Acaster: Repertoire,Dan Lucchesi,James Acaster,United Kingdom,27-Mar-18,2018,TV-14,1 Season,"British TV Shows, International TV Shows, Stand-Up Comedy & Talk Shows"
Movie,Secret Superstar,Advait Chandan,"Zaira Wasim, Meher Vij, Raj Arjun, Aamir Khan, Tirth Sharma",India,23-Mar-18,2017,TV-14,150 min,"Dramas, International Movies, Music & Musicals"
