type,title,director,cast,country,date_added,release_year,rating,duration,genre
Movie,Inuyasha the Movie - La spada del dominatore del mondo,Toshiya Shinohara,"Kappei Yamaguchi, Satsuki Yukino, Koji Tsujitani, Houko Kuwashima, Kumiko Watanabe, Ken Narita, Akio Otsuka, Kikuko Inoue",Japan,1-Sep-17,2003,TV-14,99 min,"Action & Adventure, Anime Features, International Movies"
Movie,InuYasha: The Movie 2: The Castle Beyond the Looking Glass,Toshiya Shinohara,"Kappei Yamaguchi, Satsuki Yukino, Koji Tsujitani, Houko Kuwashima, Kumiko Watanabe, Noriko Hidaka, Kenichi Ogata, Toshiyuki Morikawa, Mieko Harada",Japan,1-Sep-17,2002,TV-14,99 min,"Action & Adventure, Anime Features, International Movies"
Movie,Invictus,Clint Eastwood,"Morgan Freeman, Matt Damon, Tony Kgoroge, Patrick Mofokeng, Matt Stern, Julian Lewis Jones, Adjoa Andoh, Marguerite Wheatley, Leleti Khumalo, Patrick Lyster, Penny Downie",United States,1-Nov-19,2009,PG-13,134 min,"Dramas, Sports Movies"
Movie,Iqbal,Nagesh Kukunoor,"Shreyas Talpade, Naseeruddin Shah, Girish Karnad, Shweta Prasad, Yatin Karyekar, Prateeksha Lonkar, Dilip Salgaonkar, Jyoti Joshi, Aadarsh Balakrishna, Gururaj Manepalli",India,1-Mar-18,2006,TV-Y7,127 min,"Dramas, Independent Movies, International Movies"
Movie,Irada Pakka,Kedar Shinde,"Smita Jaykar, Siddarth Jadhav",India,15-Mar-18,2010,TV-14,137 min,"Comedies, Dramas, International Movies"
Movie,Iron Cowboy: The Story of the 50.50.50,Jacob Schwab,James Lawrence,United States,19-Jul-19,2018,TV-14,77 min,"Documentaries, Sports Movies"
Movie,Iron Man & Captain America: Heroes United,Leo Riley,"Adrian Pasdar, Roger Craig Smith, Fred Tatasciore, David Kaye, Clancy Brown, Liam O'Brien, Robin Atkin Downes, Dee Bradley Baker",United States,12-Oct-14,2014,PG,71 min,"Children & Family Movies, Sci-Fi & Fantasy"
Movie,Ishqedarriyaan,V. K. Prakash,"Suhasini Mulay, Kavin Dave, Evelyn Sharma",India,1-Mar-18,2015,TV-14,130 min,"Dramas, International Movies, Romantic Movies"
Movie,It Takes Two,Andy Tennant,"Kirstie Alley, Steve Guttenberg, Mary-Kate Olsen, Ashley Olsen, Philip Bosco, Jane Sibbett",United States,20-Nov-19,1995,PG,101 min,"Children & Family Movies, Comedies"
Movie,"It's Okay, Buddy",Hani Hamdi,"Mahmood El-Laithi, Saad El Soghayar, Nermin Maher, Safinaz",Egypt,6-Jun-19,2017,TV-14,84 min,"Comedies, International Movies, Music & Musicals"
Movie,Jaan-E-Mann: Let's Fall in Love... Again,Shirish Kunder,"Salman Khan, Akshay Kumar, Preity Zinta, Anupam Kher, Aman Verma, Javed Sheikh, Soni Razdan, Nawab Shah",India,31-Dec-19,2006,TV-14,163 min,"Dramas, International Movies, Romantic Movies"
Movie,Jack and the Cuckoo-Clock Heart,"Mathias Malzieu, Stéphane Berla","Orlando Seale, Samantha Barks, Harry Sadeghi, Stephane Cornicard, Jessie Buckley, Sophia Ellis, Barbara Scaff, Michelle Fairley, Richard Ridings, Howard Samuels","France, Belgium",8-Feb-17,2013,PG,93 min,"Children & Family Movies, Music & Musicals"
Movie,Jackpot,Dustin Nguyen,"Chi Tai, Lan Ngoc, Dustin Nguyen, Thu Trang",Vietnam,6-Oct-18,2015,TV-14,92 min,"Comedies, Dramas, International Movies"
Movie,Jail,Madhur Bhandarkar,"Neil Nitin Mukesh, Manoj Bajpayee, Mugdha Godse, Arya Babbar, Chetan Pandit, Rahul Singh, Navni Parihar, Manish Mehta",India,31-Dec-19,2009,TV-14,132 min,"Dramas, International Movies"
Movie,Jal,Girish Malik,"Purab Kohli, Tannishtha Chatterjee, Kirti Kulhari, Yashpal Sharma, Mukul Dev, Saidah Jules, Ravi Gossain, Rahul Singh",India,15-Oct-17,2013,TV-14,132 min,"Dramas, Independent Movies, International Movies"
Movie,Jalpari: The Desert Mermaid,Nila Madhab Panda,"Lehar Khan, Krishang Trivedi, Parvin Dabas, Suhasini Mulay, V.M. Badola, Tannishtha Chatterjee, Rahul Singh, Harsh Mayar",India,19-May-18,2012,TV-14,94 min,"Dramas, Independent Movies, International Movies"
Movie,Janaan,Azfar Jafri,"Armeena Rana Khan, Bilal Ashraf, Ali Rehman Khan, Hania Aamir, Usman Mukhtar, Nayyar Ejaz",Pakistan,15-Sep-17,2016,TV-14,132 min,"Comedies, Dramas, International Movies"
Movie,Jeremy Scott: The People's Designer,Vlad Yudin,Jeremy Scott,United States,1-Apr-16,2015,PG-13,109 min,Documentaries
Movie,Jesus: Countdown to Calvary,Gerry Hoban,Hugh Bonneville,"Ireland, United States, France",1-Apr-19,2018,TV-14,53 min,"Documentaries, Faith & Spirituality"
Movie,Jiro Dreams of Sushi,David Gelb,Jiro Ono,United States,5-Jun-19,2011,PG,79 min,Documentaries
Movie,John Carter,Andrew Stanton,"Taylor Kitsch, Lynn Collins, Samantha Morton, Willem Dafoe, Thomas Haden Church, Mark Strong, Ciarán Hinds, Dominic West, James Purefoy, Bryan Cranston, Polly Walker, Daryl Sabara, Art Malik, Eileen Page, Amanda Clayton, Davood Ghadami, Daniel O'Meara, Jill Baker, Josh Daugherty, Oliver Boot, Philip Arditti, Arkie Reece, Joe Billingiere, Don Stark, Darwin Shaw, Figs Jackman, David Schwimmer, Emma Clifford, Christopher Goodman, Cate Fowler, Sean Carrigan, Dusty Sorg, Steven Cree, Phil Cheadle, Holly Weston, Nicholas Woodeson, Rupert Frazer, Edmund Kente",United States,2-May-19,2012,PG-13,133 min,"Action & Adventure, Sci-Fi & Fantasy"
TV Show,Jonathan Strange & Mr Norrell,Toby Haynes,"Eddie Marsan, Bertie Carvel, Marc Warren, Charlotte Riley, Alice Englert, Samuel West, Enzo Cilenti, Paul Kaye, Edward Hogg, Ariyon Bakare",United Kingdom,25-Aug-16,2015,TV-14,1 Season,"British TV Shows, TV Dramas, TV Sci-Fi & Fantasy"
Movie,Judwaa,David Dhawan,"Salman Khan, Karisma Kapoor, Rambha, Kader Khan, Anupam Kher, Shakti Kapoor, Bindu, Reema Lagoo, Satish Shah, Mukesh Rishi",India,31-Dec-19,1997,TV-14,133 min,"Comedies, International Movies, Romantic Movies"
Movie,Judy Moody and the Not Bummer Summer,John Schultz,"Jordana Beatty, Heather Graham, Parris Mosteller, Preston Bailey, Kristoffer Ryan Winters, Garrett Ryan, Jaleel White, Ashley Boettcher, Taylar Hender, Cameron Boyce, Jenica Bergere, Janet Varney",United States,8-Aug-19,2011,PG,91 min,"Children & Family Movies, Comedies"
Movie,Julie & Julia,Nora Ephron,"Meryl Streep, Amy Adams, Stanley Tucci, Chris Messina, Linda Emond, Helen Carey, Mary Lynn Rajskub, Jane Lynch, Joan Juliet Buck",United States,1-Jan-21,2009,PG-13,123 min,"Comedies, Dramas"
Movie,Jumping the Broom,Salim Akil,"Angela Bassett, Paula Patton, Laz Alonso, Loretta Devine, Meagan Good, Tasha Smith, Julie Bowen, DeRay Davis, Valarie Pettiford, Pooch Hall, Tenika Davis, T.D. Jakes, Mike Epps, Romeo Miller, Marguerite McNeil, El DeBarge, Brian Stokes Mitchell, Gary Dourdan",United States,1-Nov-20,2011,PG-13,113 min,"Comedies, Romantic Movies"
Movie,Jupiter Ascending,"Lana Wachowski, Lilly Wachowski","Mila Kunis, Channing Tatum, Sean Bean, Eddie Redmayne, Douglas Booth, Tuppence Middleton, Nikki Amuka-Bird, Christina Cole, James D'Arcy, Gugu Mbatha-Raw","United States, Australia",1-Aug-19,2015,PG-13,128 min,"Action & Adventure, Sci-Fi & Fantasy"
Movie,Just Friends,Roger Kumble,"Anna Faris, Ty Olsson, Julie Hagerty, Amy Smart, Chris Marquette, Fred Ewanuick, Amy Matysio, Chris Klein, Ryan Reynolds, Stephen Root","Germany, United States, Canada",1-Sep-19,2005,PG-13,94 min,"Comedies, Romantic Movies"
Movie,"Justice, My Foot!",Johnnie To,"Stephen Chow, Anita Mui, Carrie Ng, Wai Ai, Benjamin Chan, Ka Sang Cheung, Wing Cho, Paul Chun, Eddy Ko, Chi Ming Lau",Hong Kong,31-Aug-18,1992,TV-14,95 min,"Action & Adventure, Comedies, International Movies"
Movie,Justin Bieber: Never Say Never,Jon M. Chu,"Justin Bieber, Ludacris, Usher Raymond, Jaden Smith, Miley Cyrus, Sean Kingston, Boyz II Men",United States,1-Jan-18,2011,G,106 min,"Documentaries, Music & Musicals"
Movie,K-19: The Widowmaker,Kathryn Bigelow,"Harrison Ford, Liam Neeson, Peter Sarsgaard, Sam Spruell, Joss Ackland, Peter Stebbings, Christian Camargo, Sam Redford, John Shrapnel, Donald Sumpter","United Kingdom, Germany, Canada, United States",21-Nov-19,2002,PG-13,138 min,"Action & Adventure, Dramas"
Movie,Kaabil,Sanjay Gupta,"Hrithik Roshan, Yami Gautam, Ronit Roy, Rohit Roy, Narendra Jha, Girish Kulkarni, Sahidur Rahaman, Suresh Menon",India,25-Jun-17,2017,TV-14,139 min,"Dramas, International Movies"
Movie,Kaakan,Kranti Redkar,"Jitendra Joshi, Urmila Kanitkar, Ashutosh Gaikwad, Ashok Shinde, Madhavi Juvekar",India,1-Mar-18,2015,TV-PG,132 min,"Dramas, International Movies, Romantic Movies"
Movie,Kaalia,Tinnu Anand,"Amitabh Bachchan, Asha Parekh, Parveen Babi, Amjad Khan, Pran, K.N. Singh, Sajjan, Murad, Kader Khan, Jagdeep",India,31-Dec-19,1981,TV-14,173 min,"Action & Adventure, Dramas, International Movies"
Movie,Kaaliyan,Jijo Pancode,"Tini Tom, Meghanathan, Balachandran Chullikadu, Shivaji Guruvayoor, Kottayam Purushan, Nithin George, Grace Antony, Shalu",India,1-Aug-18,2017,TV-PG,105 min,"Dramas, International Movies"
Movie,Kacche Dhaagey,Buta Singh,"Yograj Singh, Nitu Pandher, Deep Mandian, Shreya Chawla, Jagpal Singh Chahal, Jyoti Sharma, Janak Joshi, Karan Vinayak",India,1-Nov-17,2016,TV-14,120 min,"Dramas, International Movies, Romantic Movies"
Movie,Kahlil Gibran's The Prophet,"Roger Allers, Gaëtan Brizzi, Paul Brizzi, Joan C. Gratz, Mohammed Saeed Harib, Tomm Moore, Nina Paley, Bill Plympton, Joann Sfar, Michael Socha","Liam Neeson, Salma Hayek, John Krasinski, Frank Langella, Alfred Molina, John Rhys-Davies, Quvenzhané Wallis","United States, France, Canada, Lebanon, Qatar",1-Oct-17,2014,PG,85 min,"Children & Family Movies, Dramas"
Movie,Kajraare,Pooja Bhatt,"Himesh Reshammiya, Sara Loren, Amrita Singh, Gulshan Grover, Javed Sheikh, Adnan Shah, Natasha Sinha, Gaurav Chanana, Anupam Shyam",India,22-Oct-17,2010,TV-14,113 min,"Dramas, International Movies, Music & Musicals"
Movie,Kalki,Dhilip Kumar,"Kishore Kumar G., Yasmin Ponnappa, Mithraboomi Saravanan",India,1-Mar-18,2017,TV-14,41 min,"Dramas, Independent Movies, International Movies"
Movie,Karzzzz,Satish Kaushik,"Himesh Reshammiya, Urmila Matondkar, Shweta Kumar, Dino Morea, Raj Babbar, Danny Denzongpa, Gulshan Grover, Rohini Hattangadi, Asrani, Smita Bansal",India,22-Oct-17,2008,TV-14,137 min,"International Movies, Music & Musicals, Romantic Movies"
Movie,Kate & Leopold,James Mangold,"Meg Ryan, Hugh Jackman, Liev Schreiber, Breckin Meyer, Natasha Lyonne, Bradley Whitford, Paxton Whitehead, Spalding Gray, Josh Stamberg, Matthew Sussman",United States,1-Jan-20,2001,PG-13,118 min,"Comedies, Romantic Movies"
Movie,Katha,Sai Paranjape,"Farooq Shaikh, Naseeruddin Shah, Deepti Naval, Veeni Paranjape Joglekar, Mallika Sarabhai, Arun Joglekar",India,31-Dec-19,1982,TV-PG,140 min,"Comedies, Dramas, Independent Movies"
Movie,Kaviyude Osyath,Vineeth Anil,"Prakash Bare, Arun Kumar, Kulappulli Leela, Sangeetha Mohan, Kochu Preman",India,1-Jul-18,2017,TV-14,116 min,"Dramas, International Movies"
Movie,Kay Dyache Bola,Chandrakant Kulkarni,"Makarand Anaspure, Akshay Pendse, Umesh Kamat, Sharvari Jamenis, Sachin Khedekar, Arun Nalawade, Mohan Agashe, Nirmiti Sawant, Sanjay Mone, Amita Khopkar, Pushkar Shrotri, Ganesh Yadav",India,1-Jan-18,2005,TV-14,133 min,"Comedies, Dramas, International Movies"
TV Show,Ken Burns: The Civil War,Ken Burns,"Sam Waterston, Julie Harris, Jason Robards, Morgan Freeman, Paul Roebling, Garrison Keillor, George Black, David McCullough, Arthur Miller, Christopher Murney, Charles McDowell, Horton Foote, George Plimpton, Philip Bosco, Terry Courier, Jody Powell, Studs Terkel",United States,22-Feb-17,1990,TV-14,1 Season,Docuseries
Movie,Khalnayak,Subhash Ghai,"Sanjay Dutt, Madhuri Dixit, Jackie Shroff, Anupam Kher, Rakhee Gulzar, Pramod Moutho, Ramya Krishnan, Sushmita Mukherjee, Neena Gupta, A.K. Hangal",India,1-Mar-18,1993,TV-14,170 min,"Action & Adventure, Dramas, International Movies"
Movie,Khosla Ka Ghosla,Dibakar Banerjee,"Anupam Kher, Boman Irani, Parvin Dabas, Tara Sharma, Navin Nischol, Kiran Juneja, Ranvir Shorey, Vinod Nagpal, Vinay Pathak, Nitish Pandey",India,2-Aug-18,2006,TV-14,124 min,"Comedies, Dramas, International Movies"
Movie,Khubsoorat,Hrishikesh Mukherjee,"Ashok Kumar, Rekha, Rakesh Roshan, Shashikala, Aradhana, Dina Pathak, David Abraham, S.N. Banerjee, Keshto Mukherjee",India,31-Dec-19,1980,TV-PG,120 min,"Classic Movies, Comedies, Dramas"
Movie,Khushi,"Surya S.J., Sunil Kumar Agrawal","Fardeen Khan, Kareena Kapoor, Amrish Puri, Navin Nischol, Beena, Anup Soni, Johnny Lever, Sharat Saxena, Amitabh Bachchan, Sakshi Shivanand",India,1-Mar-18,2003,TV-14,157 min,"Comedies, International Movies, Music & Musicals"
Movie,Kia and Cosmos,Sudipto Roy,"Ritwika Pal, Swastika Mukherjee, Joy Sengupta",India,1-May-19,2018,TV-14,124 min,"Dramas, Independent Movies, International Movies"
Movie,Kid Kulafu,Paul Soriano,"Robert Villar, Alessandra de Rossi, Cesar Montano, Alex Medina, Jake Macapagal, Khalil Ramos, Jomari Angeles, Kokoy DeSantos",Philippines,4-Mar-19,2015,TV-14,108 min,"Dramas, International Movies, Sports Movies"
Movie,Kill Hitler! The Luck of the Devil,Frédéric Tonolli,Jean-Baptiste Marcenac,France,1-May-19,2015,TV-14,53 min,"Documentaries, International Movies"
Movie,Killer Klowns from Outer Space,Stephen Chiodo,"Grant Cramer, Suzanne Snyder, John Allen Nelson, John Vernon, Michael S. Siegel, Peter Licassi, Royal Dano, Christopher Titus, Irene Michaels, Karla Sue Krull",United States,1-Apr-20,1988,PG-13,86 min,"Comedies, Cult Movies, Horror Movies"
Movie,Killers,Robert Luketic,"Katherine Heigl, Ashton Kutcher, Tom Selleck, Catherine O'Hara, Katheryn Winnick, Kevin Sussman, Lisa Ann Walter, Casey Wilson, Rob Riggle, Martin Mull, Alex Borstein",United States,1-Jan-21,2010,PG-13,100 min,"Action & Adventure, Comedies, Romantic Movies"
Movie,King's Ransom,Jeffrey W. Byrd,"Anthony Anderson, Jay Mohr, Kellita Smith, Nicole Ari Parker, Regina Hall, Loretta Devine, Donald Faison, Leila Arcieri, Charlie Murphy, Brooke D'Orsay","United States, Canada",1-Nov-19,2005,PG-13,98 min,"Action & Adventure, Comedies"
Movie,Kingpin,"Peter Farrelly, Bobby Farrelly","Woody Harrelson, Randy Quaid, Vanessa Angel, Bill Murray, Chris Elliott, William Jordan, Richard Tyson, Lin Shaye",United States,1-Jan-20,1996,PG-13,114 min,"Comedies, Cult Movies, Sports Movies"
Movie,Kis Kisko Pyaar Karoon,"Abbas Alibhai Burmawalla, Mastan Alibhai Burmawalla","Kapil Sharma, Arbaaz Khan, Varun Sharma, Sharat Saxena, Supriya Pathak, Manoj Joshi, Manjari Fadnis, Simran Kaur Mundi, Elli Avram, Jamie Lever",India,1-Nov-17,2015,TV-PG,132 min,"Comedies, International Movies"
Movie,KL Zombi,Woo Ming Jin,"Zizan Razak, Siti Saleha, Zain Hamid, Izara Aishah, Fadzli Daniel Ali, Usop Wilcha",Malaysia,21-Aug-17,2013,TV-14,92 min,"Comedies, Horror Movies, International Movies"
Movie,Know Your Enemy - Japan,"Frank Capra, Joris Ivens","Walter Huston, Dana Andrews",United States,31-Mar-17,1945,TV-14,63 min,"Classic Movies, Documentaries"
Movie,Knowing,Alex Proyas,"Nicolas Cage, Chandler Canterbury, Rose Byrne, Lara Robinson, D.G. Maloney, Nadia Townsend, Alan Hopgood, Adrienne Pickering","United States, United Kingdom, Australia",1-Oct-19,2009,PG-13,121 min,"Sci-Fi & Fantasy, Thrillers"
Movie,Koko: The Gorilla Who Talks,Jonathan Taylor,Demetri Goritsas,United Kingdom,1-Mar-17,2016,TV-G,56 min,Documentaries
Movie,Kon-Tiki,"Joachim Rønning, Espen Sandberg","Pål Sverre Hagen, Anders Baasmo Christiansen, Tobias Santelmann, Gustaf Skarsgård, Odd Magnus Williamson, Jakob Oftebro, Agnes Kittelsen, Peter Wight, Amund Hellum Noraker, Eilif Hellum Noraker","United Kingdom, Norway, Denmark, Germany, Sweden",26-Apr-19,2012,PG-13,96 min,"Action & Adventure, Dramas, International Movies"
Movie,Koshish,Gulzar,"Sanjeev Kumar, Jaya Bhaduri, Asrani, Seema, Om Shivpuri, Dina Pathak",India,31-Dec-19,1972,TV-14,115 min,"International Movies, Romantic Movies"
Movie,Krish Trish and Baltiboy: Face Your Fears,Tilak Shetty,"Tarun Ratnani, Smita Malhotra, Deepak Chachra",India,17-Nov-17,2017,TV-Y7,65 min,Children & Family Movies
Movie,Kung Fu Magoo,Andrés Couturier,"Dylan Sprouse, Cole Sprouse, Alyson Stoner, Tom Kenny, Chris Parnell, Rodger Bumpass, Maile Flanagan, Wally Wingert, Candi Milo, Jim Ward","Mexico, United States",1-Aug-18,2010,TV-Y7,79 min,"Children & Family Movies, Comedies"
Movie,Kung Fu Panda: Holiday,Tim Johnson,"Jack Black, Angelina Jolie, Dustin Hoffman, Jackie Chan, Seth Rogen, Lucy Liu, David Cross, James Hong, Dan Fogler",United States,1-Dec-12,2010,TV-PG,26 min,"Children & Family Movies, Comedies"
Movie,Kung Fu Yoga,Stanley Tong,"Jackie Chan, Disha Patani, Amyra Dastur, Sonu Sood, Aarif Rahman, Miya Muqi, Zhang Yixing, Eric Tsang","China, India, Nepal",6-Oct-17,2017,TV-PG,107 min,"Action & Adventure, Comedies, International Movies"
Movie,Kya Kehna,Kundan Shah,"Preity Zinta, Saif Ali Khan, Anupam Kher, Farida Jalal, Chandrachur Singh",India,1-Apr-18,2000,TV-PG,149 min,"Dramas, International Movies, Romantic Movies"
Movie,Kyun! Ho Gaya Na,Samir Karnik,"Aishwarya Rai Bachchan, Vivek Oberoi, Amitabh Bachchan, Om Puri, Rati Agnihotri, Sunil Shetty, Tinnu Anand, Rahul Singh",India,1-Mar-18,2004,TV-PG,165 min,"International Movies, Romantic Movies"
Movie,La Bamba,Luis Valdez,"Lou Diamond Phillips, Esai Morales, Rosanna DeSoto, Elizabeth Peña, Danielle von Zerneck, Joe Pantoliano, Rick Dees, Marshall Crenshaw, Howard Huntsberry, Brian Setzer",United States,1-Jan-20,1987,PG-13,109 min,"Classic Movies, Dramas, Music & Musicals"
TV Show,La Viuda Negra,Alejandro Lozano,"Ana Serradilla, Julián Román, Ramiro Meneses, Juan Pablo Gamboa, Eileen Moreno, Luis Alfredo Velasco, Margarita Reyes, Alexander Gil, Luis Roberto Guzmán, Raúl Méndez","Colombia, Mexico, United States",15-Jan-19,2016,TV-14,1 Season,"Crime TV Shows, International TV Shows, Spanish-Language TV Shows"
Movie,Laal Rang,Syed Ahmad Afzal,"Randeep Hooda, Piaa Bajpai, Jaihind Kumar, Akshay Oberoi, Rajneesh Duggal, Ashutosh Kaushik, Meenakshi Dixit, Shreya Narayan, Rajendra Sethi",India,1-Mar-18,2016,TV-14,143 min,"Dramas, International Movies, Thrillers"
Movie,Lady in the Water,M. Night Shyamalan,"Paul Giamatti, Bryce Dallas Howard, Jeffrey Wright, Bob Balaban, Sarita Choudhury, Cindy Cheung, M. Night Shyamalan, Freddy Rodríguez, Bill Irwin, Mary Beth Hurt",United States,1-Jul-19,2006,PG-13,110 min,"Sci-Fi & Fantasy, Thrillers"
Movie,Larceny,R. Ellis Frazier,"Dolph Lundgren, Corbin Bernsen, Louis Mandylor, Isaac C. Singleton Jr., Jocelyn Osorio, Eddie J. Fernandez, David Fernandez Jr., Mauricio Mendoza, Steven Dell, Luis Gatica","United States, Mexico",15-Sep-17,2017,TV-14,87 min,Action & Adventure
Movie,Le K Benzema,"Damien Piscarel, Florent Bodin",Karim Benzema,France,1-May-18,2017,TV-14,121 min,"Documentaries, International Movies, Sports Movies"
Movie,Leap Year,Anand Tucker,"Amy Adams, Matthew Goode, Adam Scott, John Lithgow, Noel O'Donovan, Tony Rohr, Pat Laffan, Alan Devlin, Ian McElhinney, Dominique McElligott","United States, Ireland",15-Nov-19,2010,PG,100 min,"Comedies, Romantic Movies"
Movie,LeapFrog: Letter Factory,Roy Allen Smith,"Joey Camen, Marie Danielle, Mark Cacciatore, Dave Fennoy, Debi Derryberry",United States,15-Apr-20,2003,TV-Y,37 min,Children & Family Movies
Movie,LeapFrog: Numberland,Ron Myrick,"Jeannie Elias, Kat Feller, Sandy Fox, Cindy Robinson, Richard Rosenblatt",United States,15-Apr-20,2011,TV-Y,33 min,Movies
Movie,LeapFrog: Phonics Farm,Ron Myrick,"Jeannie Elias, Kat Feller, Sandy Fox, Cindy Robinson, Richard Rosenblatt",United States,15-Apr-20,2011,TV-Y,35 min,Movies
Movie,Left Behind,Vic Armstrong,"Nicolas Cage, Chad Michael Murray, Cassi Thomson, Nicky Whelan, Jordin Sparks, Lea Thompson, Gary Grubbs, Quinton Aaron","United States, Canada",26-Dec-18,2014,PG-13,110 min,"Action & Adventure, Faith & Spirituality, Sci-Fi & Fantasy"
Movie,Legend of the Guardians: The Owls of Ga'Hoole,Zack Snyder,"Helen Mirren, Geoffrey Rush, Jim Sturgess, Hugo Weaving, Emily Barclay, Abbie Cornish, Ryan Kwanten, Anthony LaPaglia, Miriam Margolyes, Sam Neill","United States, Australia",1-Jan-20,2010,PG,97 min,Children & Family Movies
Movie,Legendary Weapons of China,Chia-Liang Liu,"Gordon Liu, Chia Yung Liu, Hou Hsiao, Chia-Liang Liu, Tiet Wo Chu, Sheng Fu, Kara Hui",Hong Kong,16-Aug-18,1982,TV-14,101 min,"Action & Adventure, Cult Movies, International Movies"
TV Show,Lego Friends: Girls on a Mission,"Andrew Tan, Stephen Murray","Jasmine St. Clair, Allegra Clark, Rosamund Marks, Faye Mata, Kira Buckland, David Roach, Bradley Venable",Denmark,1-Feb-19,2018,TV-Y,1 Season,Kids' TV
Movie,Leo the Lion,Mario Cambi,"Daniel Amerman, John Cygan, Matthew Mercer, Amanda Allan, Porter Hansen, Debi Derryberry, Mari Devon, Eileen Galindo, Cole Sand","United States, Italy",20-Dec-15,2013,TV-Y7-FV,78 min,"Children & Family Movies, Comedies"
Movie,Let There Be Light,John Huston,Walter Huston,United States,31-Mar-17,1946,TV-PG,58 min,"Classic Movies, Documentaries"
Movie,Lez Bomb,Jenna Laurenzo,"Jenna Laurenzo, Deirdre O'Connell, Brandon Michael Hall, Kevin Pollak, Elaine Hendrix, Steve Guttenberg, Cloris Leachman, Bruce Dern",United States,7-Feb-19,2018,TV-14,90 min,"Comedies, LGBTQ Movies"
Movie,Lifeline,Johnnie To,"Lau Ching Wan, Alex Fong, Carman Lee, Ruby Wong, Raymond Wong Ho-Yin, Damian Lau, Lam Suet, Kenneth Chan",Hong Kong,16-Aug-18,1997,TV-14,104 min,"Action & Adventure, International Movies"
Movie,Like Arrows,Kevin Peeples,"Micah Lynn Hanson, Alan Powell, Elizabeth Becka, Garry Nation, Joseph Callender, Anisa Nyell Johnson, Aowyn Grace Peoples, John Jackson Hunter, Alex Kendrick",United States,6-May-19,2018,TV-PG,99 min,"Dramas, Faith & Spirituality"
Movie,Lincoln,Steven Spielberg,"Daniel Day-Lewis, Sally Field, David Strathairn, Joseph Gordon-Levitt, James Spader, Hal Holbrook, Tommy Lee Jones, Jackie Earle Haley, John Hawkes, Jared Harris, Joseph Cross, Tim Blake Nelson, David Oyelowo, Bruce McGill","United States, India",21-Feb-18,2012,PG-13,150 min,Dramas
Movie,Lion's Heart,Karim El Sobky,"Mohamed Ramadan, Hassan Hosny, Horeya Farghaly, Sayed Rajab, Aida Reyad, Omar Mustafa Metwally, Riham Ayman, Mohsen Mansour, Afaf Rashad, Maher Essam, Sabry Fawwaz, Hamdy Heykal, Sabry Abdel Moniem",Egypt,9-May-19,2013,TV-14,111 min,"Action & Adventure, International Movies"
Movie,Little Dragon Maiden,Hua Shan,"Leslie Cheung, Jing-Jing Yung, Chen Kuan-tai, Leanne Liu, Tanny Tien Ni",Hong Kong,1-Aug-18,1983,TV-14,92 min,"Action & Adventure, International Movies, Romantic Movies"
Movie,Little Lunch: The Halloween Horror Story,Tim Bartley,"Flynn Curry, Olivia Deeble, Madison Lu, Oisín O'Leary, Faith Seci, Joshua Sitch, Heidi Arena, Wayne Hope",Australia,15-Mar-18,2016,TV-Y7,23 min,"Children & Family Movies, Comedies"
Movie,Little Lunch: The Nightmare Before Graduation,Robyn Butler,"Flynn Curry, Olivia Deeble, Madison Lu, Oisín O'Leary, Faith Seci, Joshua Sitch, Heidi Arena, Wayne Hope",Australia,15-Mar-18,2016,TV-Y7,25 min,"Children & Family Movies, Comedies"
Movie,Little Men,Ira Sachs,"Greg Kinnear, Jennifer Ehle, Paulina García, Alfred Molina, Michael Barbieri, Theo Taplitz, Talia Balsam, Maliq Johnson, Anthony A. Flamminio, Madison Wright, John Procaccino","United States, Greece, Brazil",12-Jan-17,2016,PG,85 min,"Dramas, Independent Movies"
Movie,Little Nicky,Steve Brill,"Adam Sandler, Patricia Arquette, Harvey Keitel, Rhys Ifans, Allen Covert, Tommy 'Tiny' Lister, Kevin Nealon, Jon Lovitz, Michael McKean, Quentin Tarantino",United States,1-Dec-20,2000,PG-13,90 min,Comedies
Movie,Lizzie Borden Took an Ax,Nick Gomez,"Christina Ricci, Clea DuVall, Gregg Henry, Stephen McHattie, Shawn Doyle, Sara Botsford, Hannah Emily Anderson, Andrea Runge, Billy Campbell, Jennifer Kydd, Kirstin Howell, John Maclaren",United States,25-Jul-16,2014,TV-14,87 min,Thrillers
Movie,Lo and Behold: Reveries of the Connected World,Werner Herzog,Werner Herzog,United States,23-Dec-16,2016,PG-13,98 min,Documentaries
Movie,Lockout,"James Mather, Steve Saint Leger","Guy Pearce, Maggie Grace, Joseph Gilgun, Vincent Regan, Lennie James, Peter Stormare, Jacky Ido, Tim Plester, Mark Tankersley, Anne-Solenne Hatte","France, United States",7-May-20,2012,PG-13,95 min,"Action & Adventure, International Movies, Sci-Fi & Fantasy"
Movie,Logan's Run,Michael Anderson,"Michael York, Richard Jordan, Farrah Fawcett, Jenny Agutter, Peter Ustinov, Roscoe Lee Browne, Randolph Roberts, Gary Morgan, Greg Lewis",United States,1-Nov-19,1976,PG,118 min,"Action & Adventure, Classic Movies, Cult Movies"
Movie,Long Time Running,"Jennifer Baichwal, Nicholas de Pencier","Gord Downie, Paul Langlois, Gord Sinclair, Rob Baker, Johnny Fay, Justin Trudeau",Canada,12-Nov-17,2017,TV-14,96 min,"Documentaries, International Movies, Music & Musicals"
Movie,"Look Out, Officer",Sze Yu Lau,"Stephen Chow, Bill Tung, Stanley Sui-Fan Fung, Vivian Chan, Indra Leech, Amy Yip",Hong Kong,16-Aug-18,1990,TV-14,88 min,"Action & Adventure, Comedies, International Movies"
Movie,Lorai: Play to Live,Parambrata Chatterjee,"Prasenjit Chatterjee, Payel Sarkar, Indrasish Roy, Kanchan Mullick, Kharaj Mukherjee, Gargi Roychowdhury, Deepankar De, Biswajit Chakraborty, Bharat Kaul, Rajat Ganguly",India,1-Sep-17,2015,TV-14,155 min,"Dramas, International Movies, Sports Movies"
Movie,Love Ni Bhavai,Saandeep Patel,"Malhar Thakar, Pratik Gandhi, Aarohi Patel, Maulik Jagdish Nayak, Diana Raval, Roopa Divatia, Aarti Patel",India,1-May-18,2017,TV-14,163 min,"Comedies, International Movies, Romantic Movies"
Movie,Love on Delivery,Stephen Chow,"Stephen Chow, Christy Chung, Ng Man-Tat",Hong Kong,16-Aug-18,1994,TV-14,93 min,"Action & Adventure, Comedies, International Movies"
Movie,Love Station,Ahmad Samir Farag,"Menna Shalaby, Sherif Salama, Yousra El Lozy, Mona Hala, Edward Fouad, Lotfy Labib, Ashraf Hamdy",Egypt,25-Apr-19,2011,TV-14,97 min,"Comedies, International Movies, Romantic Movies"
Movie,Love You... Love You Not,Sridhar Jetty,"Chelsea Islan, Hamish Daud, Miller Khan, Kemal Pahlevi, R.R. Melati Pinaring, Fico Fachriza, Reynold Hamzah, Rizka Dwi Septiana, Arkanda Saezario Wicaksono",Indonesia,5-Jan-19,2015,TV-14,115 min,"Comedies, International Movies, Romantic Movies"
Movie,Loving You,Johnnie To,"Lau Ching Wan, Carman Lee, Tsung-Hua To, Chung-wai Lee, Ruby Wong",Hong Kong,16-Aug-18,1995,TV-14,79 min,"Dramas, International Movies"
